index,account_name,date,amount,currency,message,tx_type,vs,ss
0,"BROART plus, s. r. o.ZC",2022-09-07,-222,EUR,propag.predmet voľby 2022,Platobný príkaz na úhradu / FIT 2.0 (EB),20220042,
1,"MISTRO, s.r.o. Nová Baňa",2022-09-07,-696,EUR,prenájom bilbordov a tlač volby2022,Okamžitá platba (EB),22020109,
2,F.L.R. INVEST s.r.o.ZC,2022-09-06,-144,EUR,prenájom rekl.plochy-voľby 2022,Okamžitá platba (EB),10220051,
3,GREGER JAN,2022-09-01,200,EUR,Ján a Jolka Gregerova,Bezhotovostný vklad,2022,
4,,2022-08-31,-5,EUR,Zverejňovanie účtu,Poplatok,,