index,Unnamed: 0,account_name,date,amount,currency,message,tx_type,vs,ss
0,0,,2023-11-30,-5.0,EUR,Zverejňovanie účtu,Poplatok,,
1,1,,2023-11-30,-5.0,EUR,Poplatok za vedenie účtu,Poplatok,,
2,2,,2023-10-31,-5.0,EUR,Zverejňovanie účtu,Poplatok,,
3,3,,2023-10-31,-5.0,EUR,Poplatok za vedenie účtu,Poplatok,,
4,4,PETIT PRESS,2023-10-19,-1579.2,EUR,FD-2302-inzercia,Platobný príkaz na úhradu / FIT 2.0 (EB),,
5,5,"REGIONPRESS, S.R.O.",2023-10-19,-2700.0,EUR,FD-2241-inzercia,Platobný príkaz na úhradu / FIT 2.0 (EB),336230038.0,
6,6,"REGIONPRESS, S.R.O.",2023-10-19,-2700.0,EUR,FD-2242-inzercia,Platobný príkaz na úhradu / FIT 2.0 (EB),336230042.0,
7,7,"PETIT PRESS, A.S.DIV",2023-10-19,-180.0,EUR,FD-2277-inzercia,Platobný príkaz na úhradu / FIT 2.0 (EB),2335110126.0,
8,8,"PETIT PRESS, A.S.DIV",2023-10-19,-180.0,EUR,FD-2276-inzercia,Platobný príkaz na úhradu / FIT 2.0 (EB),2335110117.0,
9,9,"PETIT PRESS, A.S.DIV",2023-10-19,-180.0,EUR,FD-2275-inzercia,Platobný príkaz na úhradu / FIT 2.0 (EB),2335110114.0,
10,10,"PETIT PRESS, A.S.DIV",2023-10-19,-120.0,EUR,FD-2274-inzercia,Platobný príkaz na úhradu / FIT 2.0 (EB),2335108969.0,
11,11,COPKOVA IVETA,2023-10-19,-50.0,EUR,FD-2181-veniec,Platobný príkaz na úhradu / FIT 2.0 (EB),230019.0,
12,12,NAVI s.r.o.,2023-10-19,-249.0,EUR,FD-2180-obcerstvenie,Platobný príkaz na úhradu / FIT 2.0 (EB),342023.0,
13,13,TS Plus s.r.o.,2023-10-19,-350.0,EUR,FD-2223-obcerstvenie,Platobný príkaz na úhradu / FIT 2.0 (EB),20230020.0,
14,14,LAHODKY-DANIELA,2023-10-19,-130.0,EUR,FD-2224-mineralna voda,Platobný príkaz na úhradu / FIT 2.0 (EB),231103.0,
15,15,SMER - sociálna demokracia,2023-10-19,20253.0,EUR,Vklad prostriedkov z BU za ucelom uhrady nakladov na volby do NR SR,Bezhotovostný vklad,19102023.0,
16,16,"Bytova podnik mesta Kosice,s.r.o.",2023-10-13,-191.86,EUR,FD-2265-elektr.energia,Platobný príkaz na úhradu / FIT 2.0 (EB),512301219.0,
17,17,AKRA reklama s.r.o.,2023-10-13,-360.0,EUR,FD-2267-podpiskarty,Platobný príkaz na úhradu / FIT 2.0 (EB),110230215.0,
18,18,Pavol Repta,2023-10-13,-800.0,EUR,FD-2266-prenajom,Platobný príkaz na úhradu / FIT 2.0 (EB),2023003.0,
19,19,COLTSUN-CONSULT,2023-10-12,-400.0,EUR,"FD-2245-banner,plagat",Platobný príkaz na úhradu / FIT 2.0 (EB),2309011.0,
20,20,ADIN,2023-10-12,-310.0,EUR,FD-2244-plagaty,Platobný príkaz na úhradu / FIT 2.0 (EB),4223.0,
21,21,Jaroslav Oprala GARMONDNITRA-vydav.,2023-10-12,-192.0,EUR,FD-2239-plagaty,Platobný príkaz na úhradu / FIT 2.0 (EB),230406.0,
22,22,MESTO LEVICE,2023-10-12,-280.0,EUR,FD-2237-dan za uzivanie verej.priestranstva,Platobný príkaz na úhradu / FIT 2.0 (EB),3080000244.0,
23,23,TLACIAREN KEZMAROK G,2023-10-12,-399.6,EUR,FD-2243-letaky,Platobný príkaz na úhradu / FIT 2.0 (EB),20231347.0,
24,24,Polepy-Potlace s.r.o.,2023-10-12,-200.0,EUR,FD-2240-propagacne materialy,Platobný príkaz na úhradu / FIT 2.0 (EB),2023102.0,
25,25,"REALEXPO,S.R.O.",2023-10-12,-996.0,EUR,FD-merkantil,Platobný príkaz na úhradu / FIT 2.0 (EB),2230863.0,
26,26,"ARC Design,s.r.o.",2023-10-12,-120.0,EUR,FD-2236-plagaty,Platobný príkaz na úhradu / FIT 2.0 (EB),23088.0,
27,27,DZS Optimus s.r.o.,2023-10-12,-144.0,EUR,FD-2235-zdravot.asistencia,Platobný príkaz na úhradu / FIT 2.0 (EB),2322.0,
28,28,PETIT PRESS,2023-10-11,-324.0,EUR,FD-2212-inzercia,Platobný príkaz na úhradu / FIT 2.0 (EB),2335109654.0,
29,29,"LIPOPRINT,S.R.O.",2023-10-11,-108.0,EUR,FD-2213-plagat,Platobný príkaz na úhradu / FIT 2.0 (EB),2023241.0,
30,30,Dom kultury mesta Handlova,2023-10-11,-80.0,EUR,FD-2214-prenajom,Platobný príkaz na úhradu / FIT 2.0 (EB),5023067.0,
31,31,TS Plus s.r.o.,2023-10-11,-600.0,EUR,FD-2215-podpiskarty,Platobný príkaz na úhradu / FIT 2.0 (EB),20230021.0,
32,32,"BEEL,s.r.o.",2023-10-11,-516.0,EUR,FD-2216-podpiskarty,Platobný príkaz na úhradu / FIT 2.0 (EB),23388.0,
33,33,Duvel - Tlac a reklama s.r.o.,2023-10-11,-99.0,EUR,FD-2217-podpiskarty,Platobný príkaz na úhradu / FIT 2.0 (EB),2023178.0,
34,34,Anton Toma TOMA s.r.o.,2023-10-11,-483.84,EUR,FD-2218-reklamne predmety,Platobný príkaz na úhradu / FIT 2.0 (EB),230487.0,
35,35,Anton Toma TOMA s.r.o.,2023-10-11,-511.68,EUR,FD-2219-reklam.predmety,Platobný príkaz na úhradu / FIT 2.0 (EB),230450.0,
36,36,Building s.r.o.,2023-10-11,-201.6,EUR,FD-2220-prenajom reklamnych panelov,Platobný príkaz na úhradu / FIT 2.0 (EB),230902.0,
37,37,Duvel - Tlac a reklama s.r.o.,2023-10-11,-52.8,EUR,FD-2221-plagaty,Platobný príkaz na úhradu / FIT 2.0 (EB),2023185.0,
38,38,R&J Sound and Light s.r.o.,2023-10-11,-400.0,EUR,FD-2222-ozvucenie mitingu,Platobný príkaz na úhradu / FIT 2.0 (EB),202334.0,
39,39,SHR zvaz zdravotne postihnutych,2023-10-10,-300.0,EUR,FD-2182-kulturny program,Platobný príkaz na úhradu / FIT 2.0 (EB),722023.0,
40,40,"3M media, s.r.o.",2023-10-10,-300.0,EUR,FD-2179-video,Platobný príkaz na úhradu / FIT 2.0 (EB),23040.0,
41,41,AGAL,2023-10-10,-500.0,EUR,"FD-2178-graficke prace, sluzby na FB",Platobný príkaz na úhradu / FIT 2.0 (EB),3.0,
42,42,Stefan Ozorak ETIEN reklamka,2023-10-10,-1812.0,EUR,"FD-2177-banery,bilboard,plagaty, rekl.predmety",Platobný príkaz na úhradu / FIT 2.0 (EB),230156.0,
43,43,"EMINENT, spol. s r.o.",2023-10-10,-696.0,EUR,"FD-2176-prenajom, zvuk,technika",Platobný príkaz na úhradu / FIT 2.0 (EB),20230270.0,
44,44,Juraj Datko,2023-10-10,-410.0,EUR,FD-2175-mat.tech.zabezpecenie akcie,Platobný príkaz na úhradu / FIT 2.0 (EB),2023046.0,
45,45,Richard Horny,2023-10-10,-150.0,EUR,FD-2174-banner,Platobný príkaz na úhradu / FIT 2.0 (EB),20230086.0,
46,46,Janicek Marek - Marcraft,2023-10-10,-150.0,EUR,FD-2473-fotosluzby,Platobný príkaz na úhradu / FIT 2.0 (EB),20230044.0,
47,47,ASGuard security s.r.o.,2023-10-10,-960.0,EUR,FD-2172-bezpecnostna sluzba,Platobný príkaz na úhradu / FIT 2.0 (EB),5023069.0,
48,48,Jaroslav Timan,2023-10-10,-1060.0,EUR,FD-2151-vystupenie,Platobný príkaz na úhradu / FIT 2.0 (EB),23001.0,
49,49,Financna sprava Bratislava,2023-10-09,-13521.06,EUR,DPH-9/2023,Platobný príkaz na úhradu / FIT 2.0 (EB),1100092023.0,202309.0
50,50,Adma s.r.o.,2023-10-06,-170.0,EUR,FD-2170-prenajom vycap.zar.,Platobný príkaz na úhradu / FIT 2.0 (EB),223001.0,
51,51,MESTO STARA LUBOVNA,2023-10-06,-20.0,EUR,FD-2153-dan za uzivanie verej.priestranstva,Platobný príkaz na úhradu / FIT 2.0 (EB),1500000115.0,
52,52,Bc.Andrea Feckova Vydavatelstvo SPE,2023-10-06,-230.0,EUR,FD-2152-inzercia,Platobný príkaz na úhradu / FIT 2.0 (EB),2023121.0,
53,53,MediAdam s.r.o.,2023-10-06,-470.0,EUR,"FD-2150-tlac na bilboard,banner",Platobný príkaz na úhradu / FIT 2.0 (EB),20230902.0,
54,54,MESTSKE KULTURNE STR,2023-10-06,-21.6,EUR,FD-2149-vylep plagatov,Platobný príkaz na úhradu / FIT 2.0 (EB),2023117.0,
55,55,"Excel Media Group,s.r.o.",2023-10-06,-300.0,EUR,FD-2148-inzercia,Platobný príkaz na úhradu / FIT 2.0 (EB),230189.0,
56,56,MediAdam s.r.o.,2023-10-06,-330.0,EUR,FD-2147-tlac plagatov,Platobný príkaz na úhradu / FIT 2.0 (EB),20230903.0,
57,57,Obec Kamenica nad Cirochou,2023-10-06,-10.0,EUR,FD-2146-oznam v rozhlase,Platobný príkaz na úhradu / FIT 2.0 (EB),202335.0,
58,58,Obec Kamienka,2023-10-06,-8.0,EUR,FD-2145-oznam v rozhlase,Platobný príkaz na úhradu / FIT 2.0 (EB),3.0,
59,59,"STUDIO 9,s.r.o.",2023-10-06,-2000.0,EUR,FD-2144-Drapak,Platobný príkaz na úhradu / FIT 2.0 (EB),20230018.0,
60,60,GELATO s.r.o.,2023-10-06,-150.0,EUR,FD-2143-zmrzlina,Platobný príkaz na úhradu / FIT 2.0 (EB),2023002.0,
61,61,ADIN,2023-10-06,-156.0,EUR,FD-2142-roll-up,Platobný príkaz na úhradu / FIT 2.0 (EB),4423.0,
62,62,"D.A.H.,s.r.o. Presov",2023-10-06,-198.0,EUR,"FD-2141-banner,plagaty,podpiskarty",Platobný príkaz na úhradu / FIT 2.0 (EB),6230856.0,
63,63,PENZION CIERNA PANI-PADYCH FRANTISE,2023-10-06,-500.0,EUR,FD-2140-prenajom a obcerstvenie,Platobný príkaz na úhradu / FIT 2.0 (EB),2023274.0,
64,64,Starski s.r.o.,2023-10-06,-2730.0,EUR,"FD-2139-plagaty,letaky",Platobný príkaz na úhradu / FIT 2.0 (EB),23030386.0,
65,65,Marek Belko,2023-10-06,-770.0,EUR,FD-2138-prenajom reklamnej plochy,Platobný príkaz na úhradu / FIT 2.0 (EB),202317.0,
66,66,ASCS company s.r.o.,2023-10-06,-672.0,EUR,FD-2137-roznos letakov,Platobný príkaz na úhradu / FIT 2.0 (EB),102023.0,
67,67,REKLAMA RANGL ERIK,2023-10-06,-156.6,EUR,FD-2136-plagaty,Platobný príkaz na úhradu / FIT 2.0 (EB),2023321.0,
68,68,Fobos trading s.r.o.,2023-10-06,-1874.4,EUR,"FD-2135-plagaty,merkantil",Platobný príkaz na úhradu / FIT 2.0 (EB),3110310156.0,
69,69,Mestska cast Bratislava-Stare mesto,2023-10-06,-80.0,EUR,FD-2134-dan za uzivanie verej.priestranstva,Platobný príkaz na úhradu / FIT 2.0 (EB),6340074697.0,
70,70,Obec Nova Dedinka,2023-10-06,-195.0,EUR,FD-2133-dan za uzivanie verej.priestranstva,Platobný príkaz na úhradu / FIT 2.0 (EB),2310082.0,
71,71,MESTSK  KULT RNE STREDISKO MICHALOV,2023-10-05,-100.0,EUR,FD-2109-prenajom,Platobný príkaz na úhradu / FIT 2.0 (EB),230519.0,
72,72,LUBOVN.MEDIAL.SPOL.,2023-10-05,-263.0,EUR,FD-2108-inzercia,Platobný príkaz na úhradu / FIT 2.0 (EB),2309021.0,
73,73,3D Products s.r.o.,2023-10-05,-537.0,EUR,"FD-2107-tlac banneru,bilboardu,vylep",Platobný príkaz na úhradu / FIT 2.0 (EB),2023185.0,
74,74,MESTO SVIDN K,2023-10-05,-98.9,EUR,"FD-2106-prenajom,oznam v rozhlase",Platobný príkaz na úhradu / FIT 2.0 (EB),1310300907.0,
75,75,PONO PRESS SIVAK,2023-10-05,-100.0,EUR,FD-2105-inzercia,Platobný príkaz na úhradu / FIT 2.0 (EB),230100232.0,
76,76,TLACIAREN SVIDNICKA,2023-10-05,-439.2,EUR,"FD-2104-bilboard,plagaty,podpiskarty",Platobný príkaz na úhradu / FIT 2.0 (EB),20230904.0,
77,77,MESTO POPRAD,2023-10-05,-50.0,EUR,FD-2103-dan za uzivanie verejneho priestranstva,Platobný príkaz na úhradu / FIT 2.0 (EB),2020407941.0,2303030054.0
78,78,"PONET PRESS, Kantulak",2023-10-05,-196.8,EUR,FD-2102-inzercia,Platobný príkaz na úhradu / FIT 2.0 (EB),23187.0,
79,79,Mesto Bardejov,2023-10-05,-50.0,EUR,FD-2101-vylep plagatov,Platobný príkaz na úhradu / FIT 2.0 (EB),9015300068.0,
80,80,STABO BARDEJOV,2023-10-05,-407.76,EUR,"FD-2100-letaky,plagaty",Platobný príkaz na úhradu / FIT 2.0 (EB),2023304.0,
81,81,MESTO ZIAR NAD HRONOM,2023-10-05,-158.0,EUR,FD-2099-inzercia,Platobný príkaz na úhradu / FIT 2.0 (EB),58.0,
82,82,"APRINT, s.r.o.",2023-10-05,-546.0,EUR,FD-2098-merkantil,Platobný príkaz na úhradu / FIT 2.0 (EB),20230401.0,
83,83,AKRA reklama s.r.o.,2023-10-05,-150.0,EUR,FD-2097-podpiskarty,Platobný príkaz na úhradu / FIT 2.0 (EB),110230198.0,
84,84,Mesto Banska Bystrica,2023-10-05,-180.0,EUR,FD-2096-prenajom,Platobný príkaz na úhradu / FIT 2.0 (EB),7420230249.0,
85,85,AKRA reklama s.r.o.,2023-10-05,-4899.6,EUR,"FD-2095-podpiskarty,propagacny polep vozidla,graficke prace",Platobný príkaz na úhradu / FIT 2.0 (EB),110230200.0,
86,86,PaedDr. Peter Halaj,2023-10-05,-50.0,EUR,FD-2094-graficke prace,Platobný príkaz na úhradu / FIT 2.0 (EB),13.0,
87,87,LIJO s.r.o.,2023-10-05,-379.43,EUR,FD-2093-obcerstvenie,Platobný príkaz na úhradu / FIT 2.0 (EB),1020230019.0,
88,88,DOM ODBOROV SPOL.,2023-10-05,-54.0,EUR,FD-2092-prenajom,Platobný príkaz na úhradu / FIT 2.0 (EB),2023201.0,
89,89,PONTOS s.r.o.,2023-10-05,-420.0,EUR,FD-2091-obcerstvenie,Platobný príkaz na úhradu / FIT 2.0 (EB),2312070.0,
90,90,JOMIZ s.r.o.,2023-10-05,-280.8,EUR,FD-2090-obcerstvenie,Platobný príkaz na úhradu / FIT 2.0 (EB),2023065.0,
91,91,pure nature s.r.o.,2023-10-05,-1542.0,EUR,"FD-2089-prenajom,catering,videozaznamy",Platobný príkaz na úhradu / FIT 2.0 (EB),23010005.0,
92,92,Obec Soporna,2023-10-05,-110.0,EUR,FD-2088-prenajom saly,Platobný príkaz na úhradu / FIT 2.0 (EB),122023.0,
93,93,"MEROL Consulting, spol. s r.o.",2023-10-05,-2532.0,EUR,FD-technicke zabepecenie prevolebnych stretnuti,Platobný príkaz na úhradu / FIT 2.0 (EB),2023040.0,
94,94,"MM Gastro Trade, s.r.o.",2023-10-05,-505.0,EUR,FD-2086-technicke zabezpecenie akcie,Platobný príkaz na úhradu / FIT 2.0 (EB),10230019.0,
95,95,necsa s.r.o.,2023-10-05,-880.0,EUR,FD-2085-technicke zabepecenie akcie,Platobný príkaz na úhradu / FIT 2.0 (EB),230007.0,
96,96,FABRICO S.R.O.,2023-10-05,-476.16,EUR,FD-2084-plagaty,Platobný príkaz na úhradu / FIT 2.0 (EB),20230057.0,
97,97,Fineri s.r.o.,2023-10-05,-408.0,EUR,FD-2083-prenajom stanu,Platobný príkaz na úhradu / FIT 2.0 (EB),2300076.0,
98,98,Fineri s.r.o.,2023-10-05,-132.0,EUR,FD-2082-prenajom elektroniky,Platobný príkaz na úhradu / FIT 2.0 (EB),2300075.0,
99,99,JaWo s.r.o.,2023-10-05,-642.0,EUR,FD-2081-zabezpecenie akcie,Platobný príkaz na úhradu / FIT 2.0 (EB),2023008.0,
100,100,JaWo s.r.o.,2023-10-05,-716.0,EUR,FD-2080-zabezpecenie akcie,Platobný príkaz na úhradu / FIT 2.0 (EB),2023007.0,
101,101,Lenka Leukanicova,2023-10-05,-500.0,EUR,FD-2066-vystupenie folklor.skupiny,Platobný príkaz na úhradu / FIT 2.0 (EB),10230001.0,
102,102,,2023-10-03,-0.25,EUR,Poplatok za platbu kartou,Poplatok za kartovú transakciu,,
103,103,,2023-10-03,-102.74,EUR,"B1633410259-44544 17** **** 8717;FACEBK *975YUS3G72 ,fb.me/ads ,IE ;02.10.2023 11:28:04 ;CashBack:0 EUR",Platba kartou,,
104,104,Kosticakova Monika,2023-10-03,-1200.0,EUR,FD-2075-gulas,Platobný príkaz na úhradu / FIT 2.0 (EB),522023.0,
105,105,Obcianske zdruzenie Sobrancan,2023-10-03,-300.0,EUR,FD-2074-vystupenie suboru,Platobný príkaz na úhradu / FIT 2.0 (EB),2023007.0,
106,106,PLODOOVOC-CONTEXO s.r.o.,2023-10-03,-100.0,EUR,FD-2073-zapozicanie stolov,Platobný príkaz na úhradu / FIT 2.0 (EB),20230144.0,
107,107,"Socialny podnik Tibava,s.r.o.",2023-10-03,-50.0,EUR,FD-2072-stavebne upravy pri stanku,Platobný príkaz na úhradu / FIT 2.0 (EB),2023018.0,
108,108,Jan Kosticak,2023-10-03,-100.0,EUR,FD-2071-prenajom,Platobný príkaz na úhradu / FIT 2.0 (EB),230048.0,
109,109,PLODOOVOC-CONTEXO s.r.o.,2023-10-03,-220.61,EUR,FD-2070-repre,Platobný príkaz na úhradu / FIT 2.0 (EB),20230140.0,
110,110,D.B.comp.s.r.o.,2023-10-03,-156.0,EUR,FD-2069-LED obrazovka,Platobný príkaz na úhradu / FIT 2.0 (EB),230037.0,
111,111,Marek Moskal Restauracia ROZKVET,2023-10-03,-620.0,EUR,FD-2068-obcerstvenie,Platobný príkaz na úhradu / FIT 2.0 (EB),182023.0,
112,112,Robert Rusnak,2023-10-03,-700.0,EUR,FD-2067-gulas,Platobný príkaz na úhradu / FIT 2.0 (EB),81230081.0,
113,113,PETIT PRESS,2023-10-03,-76.5,EUR,FD-2065-inzercia,Platobný príkaz na úhradu / FIT 2.0 (EB),2335109614.0,
114,114,Erika Michalcinova - REKLAMA,2023-10-03,-1800.0,EUR,FD-2064-tech.-org.zabezpecenie mitingov,Platobný príkaz na úhradu / FIT 2.0 (EB),20230903.0,
115,115,"REGIONPRESS, S.R.O.",2023-10-03,-3531.6,EUR,FD-2063-inzercia,Platobný príkaz na úhradu / FIT 2.0 (EB),836230708.0,
116,116,"REGIONPRESS, S.R.O.",2023-10-03,-3531.6,EUR,FD-2062-inzercia,Platobný príkaz na úhradu / FIT 2.0 (EB),836230691.0,
117,117,MESTO REVUCA,2023-10-03,-30.0,EUR,FD-2061-oznam v rozhlase,Platobný príkaz na úhradu / FIT 2.0 (EB),920230166.0,
118,118,"BROART plus,s.r.o.",2023-10-03,-250.0,EUR,FD-2060-podpiskarty,Platobný príkaz na úhradu / FIT 2.0 (EB),20230033.0,
119,119,Mesto Zarnovica,2023-10-03,-476.0,EUR,FD-2059-prenajom,Platobný príkaz na úhradu / FIT 2.0 (EB),9018300081.0,
120,120,BUKOVCAN MIROSLAV,2023-10-03,-489.6,EUR,FD-2058-bagety,Platobný príkaz na úhradu / FIT 2.0 (EB),230063.0,
121,121,"POKROK VK,s.r.o.",2023-10-03,-500.0,EUR,FD-2057-inzercia,Platobný príkaz na úhradu / FIT 2.0 (EB),372023.0,
122,122,PLUTOS IMROVICOVA GABRIELA,2023-10-03,-172.0,EUR,"FD-2056-vyroba banneru,plagatov",Platobný príkaz na úhradu / FIT 2.0 (EB),2310069.0,
123,123,"ART Brezno, s.r.o.",2023-10-03,-315.0,EUR,"FD-2055-letaky, vylep plagatov",Platobný príkaz na úhradu / FIT 2.0 (EB),20230086.0,
124,124,AMIKUS spol.s r.o.,2023-10-03,-661.72,EUR,FD-2054-obcerstvenie,Platobný príkaz na úhradu / FIT 2.0 (EB),2023081.0,
125,125,"Gemerska medialna spolocnost,s.r.o.",2023-10-03,-150.0,EUR,FD-2053-PR clanok,Platobný príkaz na úhradu / FIT 2.0 (EB),20230137.0,
126,126,"OMNIKO, s.r.o.",2023-10-03,-1498.4,EUR,FD-2051-gulas,Platobný príkaz na úhradu / FIT 2.0 (EB),12023090.0,
127,127,"Pivovar Veteran,s.r.o.",2023-10-03,-300.0,EUR,FD-2050-obcerstvenie,Platobný príkaz na úhradu / FIT 2.0 (EB),1020230001.0,
128,128,Ivana Hruskova,2023-10-03,-132.0,EUR,FD-2049-propagacne materialy,Platobný príkaz na úhradu / FIT 2.0 (EB),23200178.0,
129,129,Mesto Turzovka,2023-10-03,-17.0,EUR,FD-2048-oznam v miestnom rozhlase,Platobný príkaz na úhradu / FIT 2.0 (EB),1315300151.0,
130,130,Expresta s.r.o.,2023-10-03,-75.62,EUR,FD-2047-letaky,Platobný príkaz na úhradu / FIT 2.0 (EB),41252743.0,
131,131,Expresta s.r.o.,2023-10-03,-104.87,EUR,FD-2046-letaky,Platobný príkaz na úhradu / FIT 2.0 (EB),41252743.0,
132,132,"webwx advertising,s.r.o.",2023-10-03,-100.0,EUR,FD-2045-letaky,Platobný príkaz na úhradu / FIT 2.0 (EB),230446.0,
133,133,,2023-10-02,-0.25,EUR,Poplatok za platbu kartou,Poplatok za kartovú transakciu,,
134,134,,2023-10-02,-306.66,EUR,"B1632981319-44544 17** **** 8717;GOOGLE *ADS6073399833 ,cc@google.com ,IE ;01.10.2023 19:49:26 ;CashBack:0 EUR",Platba kartou,,
135,135,,2023-09-30,-5.0,EUR,Zverejňovanie účtu,Poplatok,,
136,136,,2023-09-30,-5.0,EUR,Poplatok za vedenie účtu,Poplatok,,
137,137,polep.sk s.r.o.,2023-09-29,-343.68,EUR,"FD-2001-plagaty,banner",Platobný príkaz na úhradu / FIT 2.0 (EB),20230453.0,
138,138,Avest s.r.o.,2023-09-29,-360.0,EUR,FD-2000-tlac banneru,Platobný príkaz na úhradu / FIT 2.0 (EB),20230541.0,
139,139,Peter Hloska,2023-09-29,-2201.5,EUR,FD-1999-obcerstvenie,Platobný príkaz na úhradu / FIT 2.0 (EB),202023.0,
140,140,Mestska cast Bratislava-Karlova Ves,2023-09-29,-250.0,EUR,FD-1998-prenajom pozemku,Platobný príkaz na úhradu / FIT 2.0 (EB),3492023.0,
141,141,OBEC CHONKOVCE,2023-09-29,-250.0,EUR,FD-2030-prenajom,Platobný príkaz na úhradu / FIT 2.0 (EB),22023.0,
142,142,Vorreiter Roman PRINTMEDIA,2023-09-29,-108.0,EUR,FD-2029-billboard,Platobný príkaz na úhradu / FIT 2.0 (EB),20230160.0,
143,143,Diamond Vision s.r.o.,2023-09-29,-450.0,EUR,"FD-2028-plagaty,letaky",Platobný príkaz na úhradu / FIT 2.0 (EB),2023019.0,
144,144,AGREX s.r.o.,2023-09-29,-171.0,EUR,FD-2027-catering,Platobný príkaz na úhradu / FIT 2.0 (EB),210202.0,
145,145,Glasfol MEDIA s.r.o.,2023-09-29,-216.0,EUR,FD-2026-podpiskarty,Platobný príkaz na úhradu / FIT 2.0 (EB),20230083.0,
146,146,Anna Pirohanicova,2023-09-29,-470.0,EUR,FD-2025-obcerstvenie,Platobný príkaz na úhradu / FIT 2.0 (EB),230003.0,
147,147,Vorreiter Roman PRINTMEDIA,2023-09-29,-480.0,EUR,FD-2024-letaky,Platobný príkaz na úhradu / FIT 2.0 (EB),20230154.0,
148,148,SLUZBY MESTA MICHALO,2023-09-29,-55.0,EUR,FD-2023-obcerstvenie,Platobný príkaz na úhradu / FIT 2.0 (EB),303230009.0,
149,149,Mesto Krompachy,2023-09-29,-1.8,EUR,FD-2022-dan za uzivanie verej.priestranstva,Platobný príkaz na úhradu / FIT 2.0 (EB),3628300008.0,
150,150,"Wecko Sanita a technika, s.r.o.",2023-09-29,-180.0,EUR,FD-2021-mobilne wc,Platobný príkaz na úhradu / FIT 2.0 (EB),7230692.0,
151,151,Mala Praha s.r.o.,2023-09-29,-650.0,EUR,FD-2020-obcerstvenie,Platobný príkaz na úhradu / FIT 2.0 (EB),2023018.0,
152,152,SEDEM - reklamna agentura,2023-09-29,-793.2,EUR,"FD-2019-roll up,plagaty,podpiskarty",Platobný príkaz na úhradu / FIT 2.0 (EB),112300395.0,
153,153,SEDEM - reklamna agentura,2023-09-29,-198.0,EUR,FD-2018-podpiskarty,Platobný príkaz na úhradu / FIT 2.0 (EB),112300394.0,
154,154,OZ V OBRAZE,2023-09-29,-140.0,EUR,FD-2032-inzercia,Platobný príkaz na úhradu / FIT 2.0 (EB),20230071.0,
155,155,MF catering s.r.o.,2023-09-29,-140.0,EUR,FD-2031-obcerstvenie,Platobný príkaz na úhradu / FIT 2.0 (EB),23211.0,
156,156,"Starohorsky banicky spevokol,n.o.",2023-09-29,-150.0,EUR,FD-1967-kulturny program,Platobný príkaz na úhradu / FIT 2.0 (EB),20230802.0,
157,157,AKRA reklama s.r.o.,2023-09-29,-564.0,EUR,"FD 1966-podpiskarty, plagaty",Platobný príkaz na úhradu / FIT 2.0 (EB),110230168.0,
158,158,KOPRINT,2023-09-29,-8146.8,EUR,FD 1965-noviny,Platobný príkaz na úhradu / FIT 2.0 (EB),1023621.0,
159,159,AGAL,2023-09-29,-355.0,EUR,FD 1964-obcerstvenie,Platobný príkaz na úhradu / FIT 2.0 (EB),2.0,
160,160,OZ Facepainteri,2023-09-29,-160.0,EUR,FD 1963-malovanie na tvar,Platobný príkaz na úhradu / FIT 2.0 (EB),20230043.0,
161,161,"STEMI,s.r.o.",2023-09-29,-1000.0,EUR,FD 1962-prenajom detskych atrakcii,Platobný príkaz na úhradu / FIT 2.0 (EB),112023.0,
162,162,"GAMA Group,s.r.o.",2023-09-29,-360.0,EUR,FD-1961-zabezpecenie ochrany,Platobný príkaz na úhradu / FIT 2.0 (EB),2301018.0,
163,163,"music DRIVE production,s.r.o.",2023-09-29,-260.0,EUR,FD-1960-prenajom detskej atrakcie,Platobný príkaz na úhradu / FIT 2.0 (EB),50230017.0,
164,164,"TOP production SK,s.r.o.",2023-09-29,-214.28,EUR,FD-1959-LED reklama,Platobný príkaz na úhradu / FIT 2.0 (EB),2023049.0,
165,165,VENOM CC,2023-09-29,-288.0,EUR,FD-1958-merkantil,Platobný príkaz na úhradu / FIT 2.0 (EB),22046.0,
166,166,PRIMA PRINT S.R.O.,2023-09-29,-82.8,EUR,FD-1957-plagaty,Platobný príkaz na úhradu / FIT 2.0 (EB),202309040.0,
167,167,PRIMA PRINT S.R.O.,2023-09-29,-434.4,EUR,FD-1956-podpiskarty,Platobný príkaz na úhradu / FIT 2.0 (EB),202309017.0,
168,168,"PETIT PRESS, A.S.DIV",2023-09-29,-598.34,EUR,Zalohova fa c.62-inzercia,Platobný príkaz na úhradu / FIT 2.0 (EB),2333101835.0,
169,169,,2023-09-28,-0.25,EUR,Poplatok za platbu kartou,Poplatok za kartovú transakciu,,
170,170,,2023-09-28,-15.2,EUR,"B1630093346-44544 17** **** 8717;FACEBK *49GPJRXG72 ,fb.me/ads ,IE ;27.09.2023 23:01:57 ;CashBack:0 EUR",Platba kartou,,
171,171,,2023-09-28,-0.25,EUR,Poplatok za platbu kartou,Poplatok za kartovú transakciu,,
172,172,,2023-09-28,-11.22,EUR,"B1630093345-44544 17** **** 8717;FACEBK *EYPKMT3H72 ,fb.me/ads ,IE ;27.09.2023 22:45:40 ;CashBack:0 EUR",Platba kartou,,
173,173,,2023-09-28,-0.25,EUR,Poplatok za platbu kartou,Poplatok za kartovú transakciu,,
174,174,,2023-09-28,-634.68,EUR,"B1630093342-44544 17** **** 8717;FACEBK *N9KWPS3G72 ,fb.me/ads ,IE ;27.09.2023 22:36:19 ;CashBack:0 EUR",Platba kartou,,
175,175,,2023-09-28,-0.25,EUR,Poplatok za platbu kartou,Poplatok za kartovú transakciu,,
176,176,,2023-09-28,-500.0,EUR,"B1629823461-44544 17** **** 8717;GOOGLE *ADS6073399833 ,cc@google.com ,IE ;27.09.2023 18:14:01 ;CashBack:0 EUR",Platba kartou,,
177,177,,2023-09-28,-0.25,EUR,Poplatok za platbu kartou,Poplatok za kartovú transakciu,,
178,178,,2023-09-28,-500.0,EUR,"B1629823144-44544 17** **** 8717;GOOGLE *ADS6073399833 ,cc@google.com ,IE ;27.09.2023 16:44:02 ;CashBack:0 EUR",Platba kartou,,
179,179,,2023-09-28,-0.25,EUR,Poplatok za platbu kartou,Poplatok za kartovú transakciu,,
180,180,,2023-09-28,-500.0,EUR,"B1629821126-44544 17** **** 8717;GOOGLE *ADS6073399833 ,cc@google.com ,IE ;27.09.2023 14:14:13 ;CashBack:0 EUR",Platba kartou,,
181,181,,2023-09-28,-0.25,EUR,Poplatok za platbu kartou,Poplatok za kartovú transakciu,,
182,182,,2023-09-28,-800.0,EUR,"B1629818621-44544 17** **** 8717;FACEBK *TGBF9S7G72 ,fb.me/ads ,IE ;27.09.2023 15:39:03 ;CashBack:0 EUR",Platba kartou,,
183,183,,2023-09-28,-0.25,EUR,Poplatok za platbu kartou,Poplatok za kartovú transakciu,,
184,184,,2023-09-28,-500.0,EUR,"B1629797492-44544 17** **** 8717;GOOGLE *ADS6073399833 ,cc@google.com ,IE ;27.09.2023 15:13:51 ;CashBack:0 EUR",Platba kartou,,
185,185,,2023-09-28,-0.25,EUR,Poplatok za platbu kartou,Poplatok za kartovú transakciu,,
186,186,,2023-09-28,-800.0,EUR,"B1629796316-44544 17** **** 8717;FACEBK *V6HK3TBG72 ,fb.me/ads ,IE ;27.09.2023 05:07:55 ;CashBack:0 EUR",Platba kartou,,
187,187,,2023-09-28,-0.25,EUR,Poplatok za platbu kartou,Poplatok za kartovú transakciu,,
188,188,,2023-09-28,-800.0,EUR,"B1629790938-44544 17** **** 8717;FACEBK *GM9HMT3H72 ,fb.me/ads ,IE ;27.09.2023 21:05:09 ;CashBack:0 EUR",Platba kartou,,
189,189,,2023-09-28,-0.25,EUR,Poplatok za platbu kartou,Poplatok za kartovú transakciu,,
190,190,,2023-09-28,-800.0,EUR,"B1629790910-44544 17** **** 8717;FACEBK *HSRVQSXF72 ,fb.me/ads ,IE ;27.09.2023 18:30:27 ;CashBack:0 EUR",Platba kartou,,
191,191,,2023-09-28,-0.25,EUR,Poplatok za platbu kartou,Poplatok za kartovú transakciu,,
192,192,,2023-09-28,-800.0,EUR,"B1629785998-44544 17** **** 8717;FACEBK *JPX3MT3H72 ,fb.me/ads ,IE ;27.09.2023 12:56:51 ;CashBack:0 EUR",Platba kartou,,
193,193,,2023-09-28,-800.0,EUR,"B1629784361-44544 17** **** 8717;FACEBK *EAN7PS3G72 ,fb.me/ads ,IE ;27.09.2023 07:45:12 ;CashBack:0 EUR",Platba kartou,,
194,194,,2023-09-28,-0.25,EUR,Poplatok za platbu kartou,Poplatok za kartovú transakciu,,
195,195,,2023-09-28,-800.0,EUR,"B1629785264-44544 17** **** 8717;FACEBK *JPWXLT3H72 ,fb.me/ads ,IE ;27.09.2023 10:21:31 ;CashBack:0 EUR",Platba kartou,,
196,196,,2023-09-28,-0.25,EUR,Poplatok za platbu kartou,Poplatok za kartovú transakciu,,
197,197,,2023-09-28,-0.25,EUR,Poplatok za platbu kartou,Poplatok za kartovú transakciu,,
198,198,,2023-09-28,-500.0,EUR,"B1629781898-44544 17** **** 8717;GOOGLE *ADS6073399833 ,cc@google.com ,IE ;27.09.2023 12:13:34 ;CashBack:0 EUR",Platba kartou,,
199,199,,2023-09-28,-0.25,EUR,Poplatok za platbu kartou,Poplatok za kartovú transakciu,,
200,200,,2023-09-28,-500.0,EUR,"B1629694055-44544 17** **** 8717;GOOGLE *ADS6073399833 ,cc@google.com ,IE ;27.09.2023 20:54:57 ;CashBack:0 EUR",Platba kartou,,
201,201,,2023-09-28,-0.25,EUR,Poplatok za platbu kartou,Poplatok za kartovú transakciu,,
202,202,,2023-09-28,-500.0,EUR,"B1629640104-44544 17** **** 8717;GOOGLE *ADS6073399833 ,cc@google.com ,IE ;27.09.2023 04:19:15 ;CashBack:0 EUR",Platba kartou,,
203,203,,2023-09-28,-0.25,EUR,Poplatok za platbu kartou,Poplatok za kartovú transakciu,,
204,204,,2023-09-28,-800.0,EUR,"B1629335635-44544 17** **** 8717;FACEBK *BMBSUSKG72 ,fb.me/ads ,IE ;26.09.2023 22:21:43 ;CashBack:0 EUR",Platba kartou,,
205,205,,2023-09-28,-0.25,EUR,Poplatok za platbu kartou,Poplatok za kartovú transakciu,,
206,206,,2023-09-28,-800.0,EUR,"B1629039264-44544 17** **** 8717;FACEBK *QF5W7TFG72 ,fb.me/ads ,IE ;26.09.2023 20:34:55 ;CashBack:0 EUR",Platba kartou,,
207,207,,2023-09-28,-0.25,EUR,Poplatok za platbu kartou,Poplatok za kartovú transakciu,,
208,208,,2023-09-28,-800.0,EUR,"B1629039258-44544 17** **** 8717;FACEBK *CPMG8S7G72 ,fb.me/ads ,IE ;26.09.2023 18:41:50 ;CashBack:0 EUR",Platba kartou,,
209,209,,2023-09-28,-0.25,EUR,Poplatok za platbu kartou,Poplatok za kartovú transakciu,,
210,210,,2023-09-28,-800.0,EUR,"B1628928636-44544 17** **** 8717;FACEBK *XNME7TFG72 ,fb.me/ads ,IE ;26.09.2023 11:13:44 ;CashBack:0 EUR",Platba kartou,,
211,211,,2023-09-28,-0.25,EUR,Poplatok za platbu kartou,Poplatok za kartovú transakciu,,
212,212,,2023-09-28,-800.0,EUR,"B1628928602-44544 17** **** 8717;FACEBK *N4ZA7TFG72 ,fb.me/ads ,IE ;26.09.2023 08:35:46 ;CashBack:0 EUR",Platba kartou,,
213,213,,2023-09-28,-0.25,EUR,Poplatok za platbu kartou,Poplatok za kartovú transakciu,,
214,214,,2023-09-28,-800.0,EUR,"B1628927124-44544 17** **** 8717;FACEBK *S33J2TBG72 ,fb.me/ads ,IE ;26.09.2023 07:09:30 ;CashBack:0 EUR",Platba kartou,,
215,215,,2023-09-28,-0.25,EUR,Poplatok za platbu kartou,Poplatok za kartovú transakciu,,
216,216,,2023-09-28,-500.0,EUR,"B1628930289-44544 17** **** 8717;GOOGLE *ADS6073399833 ,cc@google.com ,IE ;26.09.2023 16:44:40 ;CashBack:0 EUR",Platba kartou,,
217,217,,2023-09-28,-0.25,EUR,Poplatok za platbu kartou,Poplatok za kartovú transakciu,,
218,218,,2023-09-28,-800.0,EUR,"B1628929193-44544 17** **** 8717;FACEBK *JQWFNS3G72 ,fb.me/ads ,IE ;26.09.2023 16:09:11 ;CashBack:0 EUR",Platba kartou,,
219,219,,2023-09-28,-0.25,EUR,Poplatok za platbu kartou,Poplatok za kartovú transakciu,,
220,220,,2023-09-28,-800.0,EUR,"B1628929162-44544 17** **** 8717;FACEBK *5U5Z8UPG72 ,fb.me/ads ,IE ;26.09.2023 13:45:42 ;CashBack:0 EUR",Platba kartou,,
221,221,,2023-09-28,-0.25,EUR,Poplatok za platbu kartou,Poplatok za kartovú transakciu,,
222,222,,2023-09-28,-500.0,EUR,"B1628918907-44544 17** **** 8717;GOOGLE *ADS6073399833 ,cc@google.com ,IE ;26.09.2023 06:19:55 ;CashBack:0 EUR",Platba kartou,,
223,223,,2023-09-28,-0.25,EUR,Poplatok za platbu kartou,Poplatok za kartovú transakciu,,
224,224,,2023-09-28,-800.0,EUR,"B1628916658-44544 17** **** 8717;FACEBK *V4SQDTTG72 ,fb.me/ads ,IE ;26.09.2023 05:59:23 ;CashBack:0 EUR",Platba kartou,,
225,225,KOSICKE FOLKLORNE STUDIO,2023-09-27,-2200.0,EUR,FD-1894-vystupenie FS,Platobný príkaz na úhradu / FIT 2.0 (EB),230012.0,
226,226,Storytelling s.r.o.,2023-09-27,-381.4,EUR,FD-1893-letaky,Platobný príkaz na úhradu / FIT 2.0 (EB),202321.0,
227,227,PETIT PRESS,2023-09-27,-540.0,EUR,Zalohova fa c.61-inzercia,Platobný príkaz na úhradu / FIT 2.0 (EB),2333101770.0,
228,228,ALTOM Reklama s.r.o.,2023-09-27,-60.0,EUR,FD-1900-polep stolika,Platobný príkaz na úhradu / FIT 2.0 (EB),23221191.0,
229,229,"PEGAS Peter Gazi a syn, spol.s r.o.",2023-09-27,-594.0,EUR,FD-1901-obcerstvenie,Platobný príkaz na úhradu / FIT 2.0 (EB),20230914.0,
230,230,Obec Kralova pri Senci,2023-09-27,-15.0,EUR,FD-1902-oznam v rozhlase,Platobný príkaz na úhradu / FIT 2.0 (EB),362023.0,
231,231,Street shops s.r.o.,2023-09-27,-1500.0,EUR,FD-1903-vystupenie Kasubovcov,Platobný príkaz na úhradu / FIT 2.0 (EB),1082023.0,
232,232,OLLE s.r.o.,2023-09-27,-70.0,EUR,FD-1904-inzercia,Platobný príkaz na úhradu / FIT 2.0 (EB),202380540.0,
233,233,ROCK FABRIC s.r.o.,2023-09-27,-400.0,EUR,FD-1905-prenajom+obcerstvenie,Platobný príkaz na úhradu / FIT 2.0 (EB),2.0,
234,234,RESTAURACIA HERKULES,2023-09-27,-727.9,EUR,FD-1906-obcerstvenie,Platobný príkaz na úhradu / FIT 2.0 (EB),2309052.0,
235,235,PRESS-ING.FECIK Michal,2023-09-27,-50.0,EUR,FD-1907-inzercia,Platobný príkaz na úhradu / FIT 2.0 (EB),2309008.0,
236,236,Lubomir Kmit - DONO,2023-09-27,-368.0,EUR,FD-1908-repre,Platobný príkaz na úhradu / FIT 2.0 (EB),233755.0,
237,237,JARDO SCHNEIDER JAROMIR,2023-09-27,-400.0,EUR,FD-1909-propagacny material,Platobný príkaz na úhradu / FIT 2.0 (EB),10230075.0,
238,238,Novocentrum Nove Zamky a.s.,2023-09-27,-600.0,EUR,FD-1939-odvysielanie reportaze v NZTV,Platobný príkaz na úhradu / FIT 2.0 (EB),20230074.0,
239,239,Grand Worx s.r.o.,2023-09-27,-370.0,EUR,FD-1940-cukrova vata,Platobný príkaz na úhradu / FIT 2.0 (EB),202338.0,
240,240,"Technicke sluzby Stareho Mesta,a.s.",2023-09-27,-144.0,EUR,FD-1941-elektricka energia,Platobný príkaz na úhradu / FIT 2.0 (EB),20230429.0,
241,241,AD HOC Malacky,2023-09-27,-200.0,EUR,FD-1942-prenajom spevnenej plochy,Platobný príkaz na úhradu / FIT 2.0 (EB),2023328.0,
242,242,Milan Grell - GRAFIT,2023-09-27,-471.98,EUR,FD-1943-spotrebny tovar,Platobný príkaz na úhradu / FIT 2.0 (EB),230911.0,
243,243,REDI s.r.o.,2023-09-27,-306.24,EUR,FD-1944-propagacny material,Platobný príkaz na úhradu / FIT 2.0 (EB),2023057.0,
244,244,FIPROSS s.r.o.,2023-09-27,-702.0,EUR,FD-1945-volebne tlacoviny,Platobný príkaz na úhradu / FIT 2.0 (EB),2023080.0,
245,245,WERTZ plus s.r.o.,2023-09-27,-90.0,EUR,FD-1946-podpiskarty,Platobný príkaz na úhradu / FIT 2.0 (EB),352023.0,
246,246,STUDIO TEXO,2023-09-27,-516.6,EUR,"FD-1947-bannery, letaky",Platobný príkaz na úhradu / FIT 2.0 (EB),230101170.0,
247,247,Maninsky poniklec,2023-09-27,-1700.0,EUR,FD 1948-prenajom party stanov a setov,Platobný príkaz na úhradu / FIT 2.0 (EB),2023001.0,
248,248,,2023-09-26,-0.25,EUR,Poplatok za platbu kartou,Poplatok za kartovú transakciu,,
249,249,,2023-09-26,-1075.98,EUR,"B1628524597-44544 17** **** 8717;FACEBK *KVGX6TFG72 ,fb.me/ads ,IE ;26.09.2023 00:39:32 ;CashBack:0 EUR",Platba kartou,,
250,250,,2023-09-26,-0.25,EUR,Poplatok za platbu kartou,Poplatok za kartovú transakciu,,
251,251,,2023-09-26,-500.0,EUR,"B1628216279-44544 17** **** 8717;GOOGLE *ADS6073399833 ,cc@google.com ,IE ;25.09.2023 18:14:07 ;CashBack:0 EUR",Platba kartou,,
252,252,,2023-09-26,-0.25,EUR,Poplatok za platbu kartou,Poplatok za kartovú transakciu,,
253,253,,2023-09-26,-800.0,EUR,"B1628214610-44544 17** **** 8717;FACEBK *A9ZB6TFG72 ,fb.me/ads ,IE ;25.09.2023 11:47:41 ;CashBack:0 EUR",Platba kartou,,
254,254,,2023-09-26,-0.25,EUR,Poplatok za platbu kartou,Poplatok za kartovú transakciu,,
255,255,,2023-09-26,-800.0,EUR,"B1628214503-44544 17** **** 8717;FACEBK *5NLUFRXG72 ,fb.me/ads ,IE ;25.09.2023 10:30:04 ;CashBack:0 EUR",Platba kartou,,
256,256,,2023-09-26,-0.25,EUR,Poplatok za platbu kartou,Poplatok za kartovú transakciu,,
257,257,,2023-09-26,-800.0,EUR,"B1628214499-44544 17** **** 8717;FACEBK *WYQSFRXG72 ,fb.me/ads ,IE ;25.09.2023 09:01:08 ;CashBack:0 EUR",Platba kartou,,
258,258,,2023-09-26,-0.25,EUR,Poplatok za platbu kartou,Poplatok za kartovú transakciu,,
259,259,,2023-09-26,-800.0,EUR,"B1628214270-44544 17** **** 8717;FACEBK *XKSLJT3H72 ,fb.me/ads ,IE ;25.09.2023 07:37:56 ;CashBack:0 EUR",Platba kartou,,
260,260,,2023-09-26,-0.25,EUR,Poplatok za platbu kartou,Poplatok za kartovú transakciu,,
261,261,,2023-09-26,-500.0,EUR,"B1628198640-44544 17** **** 8717;GOOGLE *ADS6073399833 ,cc@google.com ,IE ;25.09.2023 07:45:00 ;CashBack:0 EUR",Platba kartou,,
262,262,,2023-09-26,-0.25,EUR,Poplatok za platbu kartou,Poplatok za kartovú transakciu,,
263,263,,2023-09-26,-800.0,EUR,"B1628189804-44544 17** **** 8717;FACEBK *6K3XSSKG72 ,fb.me/ads ,IE ;25.09.2023 06:18:19 ;CashBack:0 EUR",Platba kartou,,
264,264,,2023-09-26,-5.0,EUR,"Zmena limitu na karte,2067,5,Karta č. 4544 17** **** 8717Poplatok za zmenu limitu karty",Kartový poplatok,,
265,265,,2023-09-25,-0.25,EUR,Poplatok za platbu kartou,Poplatok za kartovú transakciu,,
266,266,,2023-09-25,-983.14,EUR,"B1627896783-44544 17** **** 8717;FACEBK *8YWB7UPG72 ,fb.me/ads ,IE ;25.09.2023 00:05:50 ;CashBack:0 EUR",Platba kartou,,
267,267,,2023-09-25,-500.0,EUR,"B1627741560-44544 17** **** 8717;GOOGLE *ADS6073399833 ,cc@google.com ,IE ;24.09.2023 18:46:41 ;CashBack:0 EUR",Platba kartou,,
268,268,,2023-09-25,-0.25,EUR,Poplatok za platbu kartou,Poplatok za kartovú transakciu,,
269,269,,2023-09-25,-0.25,EUR,Poplatok za platbu kartou,Poplatok za kartovú transakciu,,
270,270,,2023-09-25,-500.0,EUR,"B1627726385-44544 17** **** 8717;GOOGLE *ADS6073399833 ,cc@google.com ,IE ;24.09.2023 09:36:53 ;CashBack:0 EUR",Platba kartou,,
271,271,,2023-09-25,-0.25,EUR,Poplatok za platbu kartou,Poplatok za kartovú transakciu,,
272,272,,2023-09-25,-800.0,EUR,"B1627707388-44544 17** **** 8717;FACEBK *QZYSYSBG72 ,fb.me/ads ,IE ;24.09.2023 15:59:06 ;CashBack:0 EUR",Platba kartou,,
273,273,,2023-09-25,-800.0,EUR,"B1627705688-44544 17** **** 8717;FACEBK *ADRVBTTG72 ,fb.me/ads ,IE ;24.09.2023 13:24:42 ;CashBack:0 EUR",Platba kartou,,
274,274,,2023-09-25,-0.25,EUR,Poplatok za platbu kartou,Poplatok za kartovú transakciu,,
275,275,,2023-09-25,-800.0,EUR,"B1627705676-44544 17** **** 8717;FACEBK *ZZYKYSBG72 ,fb.me/ads ,IE ;24.09.2023 11:03:55 ;CashBack:0 EUR",Platba kartou,,
276,276,,2023-09-25,-0.25,EUR,Poplatok za platbu kartou,Poplatok za kartovú transakciu,,
277,277,,2023-09-25,-0.25,EUR,Poplatok za platbu kartou,Poplatok za kartovú transakciu,,
278,278,,2023-09-25,-800.0,EUR,"B1627705492-44544 17** **** 8717;FACEBK *Z4EM6UPG72 ,fb.me/ads ,IE ;24.09.2023 09:04:35 ;CashBack:0 EUR",Platba kartou,,
279,279,,2023-09-25,-0.25,EUR,Poplatok za platbu kartou,Poplatok za kartovú transakciu,,
280,280,,2023-09-25,-800.0,EUR,"B1627705447-44544 17** **** 8717;FACEBK *FFAFYSBG72 ,fb.me/ads ,IE ;24.09.2023 07:30:23 ;CashBack:0 EUR",Platba kartou,,
281,281,,2023-09-25,-0.25,EUR,Poplatok za platbu kartou,Poplatok za kartovú transakciu,,
282,282,,2023-09-25,-800.0,EUR,"B1627675678-44544 17** **** 8717;FACEBK *C92G6UPG72 ,fb.me/ads ,IE ;24.09.2023 05:24:59 ;CashBack:0 EUR",Platba kartou,,
283,283,,2023-09-24,-0.25,EUR,Poplatok za platbu kartou,Poplatok za kartovú transakciu,,
284,284,,2023-09-24,-800.0,EUR,"B1627149845-44544 17** **** 8717;FACEBK *PK986UPG72 ,fb.me/ads ,IE ;23.09.2023 23:02:40 ;CashBack:0 EUR",Platba kartou,,
285,285,,2023-09-24,-0.25,EUR,Poplatok za platbu kartou,Poplatok za kartovú transakciu,,
286,286,,2023-09-24,-800.0,EUR,"B1627036978-44544 17** **** 8717;FACEBK *Y7VNLSXF72 ,fb.me/ads ,IE ;23.09.2023 21:22:44 ;CashBack:0 EUR",Platba kartou,,
287,287,,2023-09-24,-0.25,EUR,Poplatok za platbu kartou,Poplatok za kartovú transakciu,,
288,288,,2023-09-24,-800.0,EUR,"B1627036970-44544 17** **** 8717;FACEBK *RU5XXSBG72 ,fb.me/ads ,IE ;23.09.2023 19:02:58 ;CashBack:0 EUR",Platba kartou,,
289,289,,2023-09-24,-0.25,EUR,Poplatok za platbu kartou,Poplatok za kartovú transakciu,,
290,290,,2023-09-24,-800.0,EUR,"B1627031277-44544 17** **** 8717;FACEBK *D73X5UPG72 ,fb.me/ads ,IE ;23.09.2023 16:52:12 ;CashBack:0 EUR",Platba kartou,,
291,291,,2023-09-24,-0.25,EUR,Poplatok za platbu kartou,Poplatok za kartovú transakciu,,
292,292,,2023-09-24,-800.0,EUR,"B1627031005-44544 17** **** 8717;FACEBK *MTJ5RSKG72 ,fb.me/ads ,IE ;23.09.2023 13:00:59 ;CashBack:0 EUR",Platba kartou,,
293,293,,2023-09-24,-0.25,EUR,Poplatok za platbu kartou,Poplatok za kartovú transakciu,,
294,294,,2023-09-24,-800.0,EUR,"B1627030989-44544 17** **** 8717;FACEBK *ZUTLDRXG72 ,fb.me/ads ,IE ;23.09.2023 07:04:41 ;CashBack:0 EUR",Platba kartou,,
295,295,,2023-09-24,-0.25,EUR,Poplatok za platbu kartou,Poplatok za kartovú transakciu,,
296,296,,2023-09-24,-500.0,EUR,"B1626962967-44544 17** **** 8717;GOOGLE *ADS6073399833 ,cc@google.com ,IE ;23.09.2023 08:25:13 ;CashBack:0 EUR",Platba kartou,,
297,297,,2023-09-24,-0.25,EUR,Poplatok za platbu kartou,Poplatok za kartovú transakciu,,
298,298,,2023-09-24,-500.0,EUR,"B1626962964-44544 17** **** 8717;GOOGLE *ADS6073399833 ,cc@google.com ,IE ;23.09.2023 17:08:00 ;CashBack:0 EUR",Platba kartou,,
299,299,,2023-09-23,-0.25,EUR,Poplatok za platbu kartou,Poplatok za kartovú transakciu,,
300,300,,2023-09-23,-800.0,EUR,"B1626216042-44544 17** **** 8717;FACEBK *S45A4S7G72 ,fb.me/ads ,IE ;22.09.2023 20:44:17 ;CashBack:0 EUR",Platba kartou,,
301,301,,2023-09-23,-0.25,EUR,Poplatok za platbu kartou,Poplatok za kartovú transakciu,,
302,302,,2023-09-23,-500.0,EUR,"B1626110422-44544 17** **** 8717;GOOGLE *ADS6073399833 ,cc@google.com ,IE ;22.09.2023 08:29:36 ;CashBack:0 EUR",Platba kartou,,
303,303,,2023-09-23,-0.25,EUR,Poplatok za platbu kartou,Poplatok za kartovú transakciu,,
304,304,,2023-09-23,-500.0,EUR,"B1626106986-44544 17** **** 8717;GOOGLE *ADS6073399833 ,cc@google.com ,IE ;22.09.2023 18:38:29 ;CashBack:0 EUR",Platba kartou,,
305,305,,2023-09-23,-0.25,EUR,Poplatok za platbu kartou,Poplatok za kartovú transakciu,,
306,306,,2023-09-23,-800.0,EUR,"B1626099430-44544 17** **** 8717;FACEBK *ESCSFT3H72 ,fb.me/ads ,IE ;22.09.2023 14:56:29 ;CashBack:0 EUR",Platba kartou,,
307,307,,2023-09-23,-0.25,EUR,Poplatok za platbu kartou,Poplatok za kartovú transakciu,,
308,308,,2023-09-23,-800.0,EUR,"B1626097041-44544 17** **** 8717;FACEBK *LAH23TFG72 ,fb.me/ads ,IE ;22.09.2023 08:18:21 ;CashBack:0 EUR",Platba kartou,,
309,309,,2023-09-22,-0.25,EUR,Poplatok za platbu kartou,Poplatok za kartovú transakciu,,
310,310,,2023-09-22,-800.0,EUR,"B1625352564-44544 17** **** 8717;FACEBK *LJQK2TFG72 ,fb.me/ads ,IE ;21.09.2023 21:20:37 ;CashBack:0 EUR",Platba kartou,,
311,311,,2023-09-22,-0.25,EUR,Poplatok za platbu kartou,Poplatok za kartovú transakciu,,
312,312,,2023-09-22,-500.0,EUR,"B1625237049-44544 17** **** 8717;GOOGLE *ADS6073399833 ,cc@google.com ,IE ;21.09.2023 18:05:31 ;CashBack:0 EUR",Platba kartou,,
313,313,,2023-09-22,-0.25,EUR,Poplatok za platbu kartou,Poplatok za kartovú transakciu,,
314,314,,2023-09-22,-800.0,EUR,"B1625232818-44544 17** **** 8717;FACEBK *ABV6JSXF72 ,fb.me/ads ,IE ;21.09.2023 15:15:25 ;CashBack:0 EUR",Platba kartou,,
315,315,,2023-09-22,-0.25,EUR,Poplatok za platbu kartou,Poplatok za kartovú transakciu,,
316,316,,2023-09-22,-800.0,EUR,"B1624830647-44544 17** **** 8717;FACEBK *N6AWUSBG72 ,fb.me/ads ,IE ;20.09.2023 23:18:41 ;CashBack:0 EUR",Platba kartou,,
317,317,,2023-09-22,-500.0,EUR,"B1624526792-44544 17** **** 8717;GOOGLE *ADS6073399833 ,cc@google.com ,IE ;20.09.2023 16:47:33 ;CashBack:0 EUR",Platba kartou,,
318,318,,2023-09-22,-0.25,EUR,Poplatok za platbu kartou,Poplatok za kartovú transakciu,,
319,319,,2023-09-22,-800.0,EUR,"B1624448195-44544 17** **** 8717;FACEBK *ZNNUFS3G72 ,fb.me/ads ,IE ;20.09.2023 11:50:45 ;CashBack:0 EUR",Platba kartou,,
320,320,,2023-09-22,-0.25,EUR,Poplatok za platbu kartou,Poplatok za kartovú transakciu,,
321,321,,2023-09-22,-800.0,EUR,"B1624448581-44544 17** **** 8717;FACEBK *K9NLUSBG72 ,fb.me/ads ,IE ;20.09.2023 16:35:42 ;CashBack:0 EUR",Platba kartou,,
322,322,,2023-09-22,-0.25,EUR,Poplatok za platbu kartou,Poplatok za kartovú transakciu,,
323,323,,2023-09-22,-0.25,EUR,Poplatok za platbu kartou,Poplatok za kartovú transakciu,,
324,324,,2023-09-22,-800.0,EUR,"B1624241421-44544 17** **** 8717;FACEBK *CNSBARXG72 ,fb.me/ads ,IE ;20.09.2023 05:47:14 ;CashBack:0 EUR",Platba kartou,,
325,325,Mesto Nitra,2023-09-21,-52.8,EUR,FD-1857-dan za uzivanie verejneho priestranstva,Platobný príkaz na úhradu / FIT 2.0 (EB),1400339392.0,2303057426.0
326,326,MESTO TRNAVA,2023-09-21,-90.0,EUR,FD-1858-dan za uzivanie verejneho priestranstva,Platobný príkaz na úhradu / FIT 2.0 (EB),1500009700.0,
327,327,"EKO HOLDING Slovakia, s.r.o.",2023-09-21,-1269.0,EUR,FD-1859-program na podujati,Platobný príkaz na úhradu / FIT 2.0 (EB),2023005.0,
328,328,PRIMA-PRINT,2023-09-21,-537.6,EUR,FD-1860-graficke spracovanie,Platobný príkaz na úhradu / FIT 2.0 (EB),202308077.0,
329,329,AKRA reklama s.r.o.,2023-09-21,-1872.0,EUR,"FD1861-podpiskarta,kalendariky",Platobný príkaz na úhradu / FIT 2.0 (EB),110230184.0,
330,330,pure nature s.r.o.,2023-09-21,-1345.01,EUR,"FD1862-graficke prace,prenajom,catering",Platobný príkaz na úhradu / FIT 2.0 (EB),23010004.0,
331,331,Mesto Nitra,2023-09-21,-16.5,EUR,FD-1863-dan za uzivanie verej.priestranstva,Platobný príkaz na úhradu / FIT 2.0 (EB),1400339392.0,2303057143.0
332,332,Lenka Turokova - LMGraphics,2023-09-21,-455.0,EUR,"FD-1864-karticky,letaky",Platobný príkaz na úhradu / FIT 2.0 (EB),2023082.0,
333,333,"DOPA SK, s.r.o.",2023-09-21,-348.0,EUR,FD-1865-preprava,Platobný príkaz na úhradu / FIT 2.0 (EB),2023022.0,
334,334,"PEPANI,s.r.o.",2023-09-21,-143.4,EUR,FD-1866-kolace,Platobný príkaz na úhradu / FIT 2.0 (EB),2300052.0,
335,335,"REGIONPRESS, S.R.O.",2023-09-21,-1166.4,EUR,FD-1867-inzercia,Platobný príkaz na úhradu / FIT 2.0 (EB),836230674.0,
336,336,"REGIONPRESS, S.R.O.",2023-09-21,-1166.4,EUR,FD-1868-inzercia,Platobný príkaz na úhradu / FIT 2.0 (EB),836230657.0,
337,337,Mgr.Peter Madzik,2023-09-21,-380.0,EUR,FD-1869-bilboard,Platobný príkaz na úhradu / FIT 2.0 (EB),2023013.0,
338,338,BRUTUS s.r.o.Trebisov,2023-09-21,-641.6,EUR,FD-1870-obcerstvenie,Platobný príkaz na úhradu / FIT 2.0 (EB),1020230137.0,
339,339,KREDATUSOVA IVANA,2023-09-21,-190.81,EUR,FD-1847-vence,Platobný príkaz na úhradu / FIT 2.0 (EB),462023.0,
340,340,OBEC PRAKOVCE,2023-09-21,-920.35,EUR,FD-1846-obcerstvenie,Platobný príkaz na úhradu / FIT 2.0 (EB),1318300035.0,
341,341,"MG-future, s.r.o.",2023-09-21,-960.0,EUR,FD-1845-prenajom podia,Platobný príkaz na úhradu / FIT 2.0 (EB),20231062.0,
342,342,Folklorna skupina Radzim Vysna Slan,2023-09-21,-200.0,EUR,FD-1844-vystupenie folklornej skupiny,Platobný príkaz na úhradu / FIT 2.0 (EB),23001.0,
343,343,Anna Manojlovicova Ing.,2023-09-21,-780.0,EUR,FD-1843-prenajom a obcerstvenie,Platobný príkaz na úhradu / FIT 2.0 (EB),2023087.0,
344,344,Obec Trebisov,2023-09-21,-40.0,EUR,FD-1842-dan za uzivanie verej.priestranstva,Platobný príkaz na úhradu / FIT 2.0 (EB),1500024692.0,2303013577.0
345,345,Obec Trebisov,2023-09-21,-40.0,EUR,FD-1841-zhotovenie putaca,Platobný príkaz na úhradu / FIT 2.0 (EB),5002300117.0,
346,346,Slovensky cerveny kriz Roznava,2023-09-21,-60.0,EUR,FD-1840-hliadka prvej pomoci,Platobný príkaz na úhradu / FIT 2.0 (EB),422023.0,
347,347,NIKA PRESS s.r.o.,2023-09-21,-240.0,EUR,FD-1839-prenajom city lightov,Platobný príkaz na úhradu / FIT 2.0 (EB),30230211.0,
348,348,Radioslav Hrenko GALAXY,2023-09-21,-700.0,EUR,FD-1838-obcerstvenie,Platobný príkaz na úhradu / FIT 2.0 (EB),230052.0,
349,349,Obec Cervenik,2023-09-21,-295.0,EUR,FD-1837-prenajom stanu,Platobný príkaz na úhradu / FIT 2.0 (EB),27.0,
350,350,Obec Chtelnica,2023-09-21,-100.0,EUR,FD-1836-prenajom,Platobný príkaz na úhradu / FIT 2.0 (EB),202343.0,
351,351,PaE gastro s.r.o.,2023-09-21,-80.0,EUR,FD-1835-prenajom,Platobný príkaz na úhradu / FIT 2.0 (EB),230070.0,
352,352,Obec Smolenice,2023-09-21,-110.0,EUR,FD-1834-prenajom,Platobný príkaz na úhradu / FIT 2.0 (EB),1462023.0,
353,353,Obec Vrakun,2023-09-21,-980.0,EUR,FD-1833-technicke zabezpecenie polit.akcie,Platobný príkaz na úhradu / FIT 2.0 (EB),941.0,
354,354,RAPOS s.r.o.,2023-09-21,-10.33,EUR,FD-1832-plagat,Platobný príkaz na úhradu / FIT 2.0 (EB),2023931.0,
355,355,Actly s.r.o.,2023-09-21,-13380.0,EUR,FD-1738-prieskum verejnej mienky,Platobný príkaz na úhradu / FIT 2.0 (EB),2023035.0,
356,356,,2023-09-20,-0.25,EUR,Poplatok za platbu kartou,Poplatok za kartovú transakciu,,
357,357,,2023-09-20,-800.0,EUR,"B1623649428-44544 17** **** 8717;FACEBK *LHKE9RXG72 ,fb.me/ads ,IE ;19.09.2023 09:43:04 ;CashBack:0 EUR",Platba kartou,,
358,358,,2023-09-20,-0.25,EUR,Poplatok za platbu kartou,Poplatok za kartovú transakciu,,
359,359,,2023-09-20,-800.0,EUR,"B1623639346-44544 17** **** 8717;FACEBK *WLQ9YSFG72 ,fb.me/ads ,IE ;19.09.2023 17:37:56 ;CashBack:0 EUR",Platba kartou,,
360,360,,2023-09-20,-0.25,EUR,Poplatok za platbu kartou,Poplatok za kartovú transakciu,,
361,361,,2023-09-20,-500.0,EUR,"B1623630433-44544 17** **** 8717;GOOGLE *ADS6073399833 ,cc@google.com ,IE ;19.09.2023 08:55:26 ;CashBack:0 EUR",Platba kartou,,
362,362,,2023-09-19,-0.25,EUR,Poplatok za platbu kartou,Poplatok za kartovú transakciu,,
363,363,,2023-09-19,-800.0,EUR,"B1623186006-44544 17** **** 8717;FACEBK *GH56ES3G72 ,fb.me/ads ,IE ;18.09.2023 22:08:34 ;CashBack:0 EUR",Platba kartou,,
364,364,,2023-09-19,-0.25,EUR,Poplatok za platbu kartou,Poplatok za kartovú transakciu,,
365,365,,2023-09-19,-800.0,EUR,"B1622820457-44544 17** **** 8717;FACEBK *8TR85TTG72 ,fb.me/ads ,IE ;18.09.2023 08:20:09 ;CashBack:0 EUR",Platba kartou,,
366,366,"REGIONPRESS, S.R.O.",2023-09-19,-282.0,EUR,Zaloh.fa c.57-inzercia,Platobný príkaz na úhradu / FIT 2.0 (EB),814210162.0,
367,367,CULTUS RU INOV,2023-09-19,-1000.0,EUR,FD-1810-najomne,Platobný príkaz na úhradu / FIT 2.0 (EB),762023.0,
368,368,"EKO HOLDING Slovakia, s.r.o.",2023-09-19,-1264.0,EUR,"FD-1811-program,ozvucenie,prenajom...",Platobný príkaz na úhradu / FIT 2.0 (EB),2023003.0,
369,369,Rudolf Ruza,2023-09-19,-1373.12,EUR,FD-1812-obcerstvenie pri akcii,Platobný príkaz na úhradu / FIT 2.0 (EB),22300557.0,
370,370,LOGAN MEDIA s.r.o.,2023-09-19,-2262.23,EUR,"FD-1813-prenajom,kynologickych sluzieb,obcerstvenie",Platobný príkaz na úhradu / FIT 2.0 (EB),1020230008.0,
371,371,Veverka Vladimir Ing.,2023-09-19,-150.0,EUR,FD-1814-fotogarfovanie,Platobný príkaz na úhradu / FIT 2.0 (EB),20230044.0,
372,372,"Urbar-zeliar-pasienky,poz.spol.",2023-09-19,-228.8,EUR,FD-1815-drevo,Platobný príkaz na úhradu / FIT 2.0 (EB),230032.0,
373,373,KREMPEK s.r.o.,2023-09-19,-397.92,EUR,FD-1816-obcerstvenie pri akcii SNP,Platobný príkaz na úhradu / FIT 2.0 (EB),2023100839.0,
374,374,PEMA STROJ s.r.o.,2023-09-19,-200.0,EUR,FD-1817-vatra,Platobný príkaz na úhradu / FIT 2.0 (EB),2023155.0,
375,375,Branislav Navoj - FOTOStudio,2023-09-19,-80.0,EUR,FD-1818-fotosnimok,Platobný príkaz na úhradu / FIT 2.0 (EB),202327.0,
376,376,,2023-09-18,-0.25,EUR,Poplatok za platbu kartou,Poplatok za kartovú transakciu,,
377,377,,2023-09-18,-500.0,EUR,"B1622301069-44544 17** **** 8717;GOOGLE *ADS6073399833 ,cc@google.com ,IE ;17.09.2023 21:11:01 ;CashBack:0 EUR",Platba kartou,,
378,378,,2023-09-18,-0.25,EUR,Poplatok za platbu kartou,Poplatok za kartovú transakciu,,
379,379,,2023-09-18,-800.0,EUR,"B1622256287-44544 17** **** 8717;FACEBK *8TVGAT3H72 ,fb.me/ads ,IE ;17.09.2023 15:51:55 ;CashBack:0 EUR",Platba kartou,,
380,380,AGENTURA SMER,2023-09-18,-160000.0,EUR,Zalohova fa c. 56 na volby do NRSR 2023,Platobný príkaz na úhradu / FIT 2.0 (EB),230800005.0,
381,381,AGENTURA SMER,2023-09-18,-160000.0,EUR,Zaloh.fa c.56 na volby do NRSR 2023,Platobný príkaz na úhradu / FIT 2.0 (EB),230800005.0,
382,382,AGENTURA SMER,2023-09-18,-80000.0,EUR,Zalohova fa c.56 na volby do NRSR 2023,Platobný príkaz na úhradu / FIT 2.0 (EB),230800005.0,
383,383,Klesik Jozef - POHOSTINSTVO,2023-09-18,-1480.0,EUR,FD-1792-obcerstvenie pri prezentacii strany,Platobný príkaz na úhradu / FIT 2.0 (EB),4123.0,
384,384,Mesto Vranov nad Toplou,2023-09-18,-6.0,EUR,FD-1793-dan za uzivanie verejneho rpiestranstva,Platobný príkaz na úhradu / FIT 2.0 (EB),2120300099.0,
385,385,MESTSKE KULTURNE STR,2023-09-18,-150.0,EUR,FD-1794-prenajom kinosaly,Platobný príkaz na úhradu / FIT 2.0 (EB),1116300143.0,
386,386,SMER - sociálna demokracia,2023-09-18,80000.0,EUR,Prevod z bezneho uctu SMER-SSD,Bezhotovostný vklad,18092023.0,
387,387,SMER - sociálna demokracia,2023-09-18,160000.0,EUR,Prevod z bezneho uctu SMER-SSD,Bezhotovostný vklad,18092023.0,
388,388,SMER - sociálna demokracia,2023-09-18,160000.0,EUR,Prevod z bezneho uctu SMER-SSD,Bezhotovostný vklad,18092023.0,
389,389,,2023-09-17,-0.25,EUR,Poplatok za platbu kartou,Poplatok za kartovú transakciu,,
390,390,,2023-09-17,-800.0,EUR,"B1621530026-44544 17** **** 8717;FACEBK *H4Z6DSXF72 ,fb.me/ads ,IE ;16.09.2023 21:36:31 ;CashBack:0 EUR",Platba kartou,,
391,391,,2023-09-17,-0.25,EUR,Poplatok za platbu kartou,Poplatok za kartovú transakciu,,
392,392,,2023-09-17,-500.0,EUR,"B1621473498-44544 17** **** 8717;GOOGLE *ADS6073399833 ,cc@google.com ,IE ;16.09.2023 18:10:19 ;CashBack:0 EUR",Platba kartou,,
393,393,,2023-09-17,-0.25,EUR,Poplatok za platbu kartou,Poplatok za kartovú transakciu,,
394,394,,2023-09-17,-800.0,EUR,"B1621454855-44544 17** **** 8717;FACEBK *GENHHSKG72 ,fb.me/ads ,IE ;16.09.2023 09:09:51 ;CashBack:0 EUR",Platba kartou,,
395,395,,2023-09-16,-0.25,EUR,Poplatok za platbu kartou,Poplatok za kartovú transakciu,,
396,396,,2023-09-16,-800.0,EUR,"B1621010260-44544 17** **** 8717;FACEBK *2KRMAS3G72 ,fb.me/ads ,IE ;15.09.2023 14:46:56 ;CashBack:0 EUR",Platba kartou,,
397,397,,2023-09-16,-0.25,EUR,Poplatok za platbu kartou,Poplatok za kartovú transakciu,,
398,398,,2023-09-16,-500.0,EUR,"B1620874070-44544 17** **** 8717;GOOGLE *ADS6073399833 ,cc@google.com ,IE ;15.09.2023 10:35:38 ;CashBack:0 EUR",Platba kartou,,
399,399,,2023-09-16,-0.25,EUR,Poplatok za platbu kartou,Poplatok za kartovú transakciu,,
400,400,,2023-09-16,-800.0,EUR,"B1619967022-44544 17** **** 8717;FACEBK *TNTM4RXG72 ,fb.me/ads ,IE ;14.09.2023 20:44:17 ;CashBack:0 EUR",Platba kartou,,
401,401,,2023-09-16,-0.25,EUR,Poplatok za platbu kartou,Poplatok za kartovú transakciu,,
402,402,,2023-09-16,-800.0,EUR,"B1619848462-44544 17** **** 8717;FACEBK *U4UNTTPG72 ,fb.me/ads ,IE ;14.09.2023 04:17:13 ;CashBack:0 EUR",Platba kartou,,
403,403,,2023-09-15,-0.25,EUR,Poplatok za platbu kartou,Poplatok za kartovú transakciu,,
404,404,,2023-09-15,-500.0,EUR,"B1619190439-44544 17** **** 8717;GOOGLE *ADS6073399833 ,cc@google.com ,IE ;14.09.2023 00:45:45 ;CashBack:0 EUR",Platba kartou,,
405,405,,2023-09-15,-0.25,EUR,Poplatok za platbu kartou,Poplatok za kartovú transakciu,,
406,406,,2023-09-15,-831.7,EUR,"B1618939597-44544 17** **** 8717;FACEBK *GWNX2RXG72 ,fb.me/ads ,IE ;13.09.2023 06:49:48 ;CashBack:0 EUR",Platba kartou,,
407,407,Starski s.r.o.,2023-09-14,-9798.0,EUR,"FD-1787-foto,inzercia,plagaty,letaky",Platobný príkaz na úhradu / FIT 2.0 (EB),23030362.0,
408,408,Obec Bernolakovo,2023-09-14,-20.0,EUR,FD-1785-dan za uzivanie verejneho priestranstva,Platobný príkaz na úhradu / FIT 2.0 (EB),7000582023.0,
409,409,Obec Bernolakovo,2023-09-14,-8.4,EUR,FD-1784-dan za uzivanie verejneho priestranstva,Platobný príkaz na úhradu / FIT 2.0 (EB),7000572023.0,
410,410,M.D.N s.r.o.,2023-09-14,-9364.74,EUR,"FD-1790-polep auta, plagaty,tricka, letaky,podpis karty",Platobný príkaz na úhradu / FIT 2.0 (EB),23020058.0,
411,411,,2023-09-14,-0.25,EUR,Poplatok za platbu kartou,Poplatok za kartovú transakciu,,
412,412,,2023-09-14,-500.0,EUR,"B1618238664-44544 17** **** 8717;GOOGLE *ADS6073399833 ,cc@google.com ,IE ;12.09.2023 20:23:37 ;CashBack:0 EUR",Platba kartou,,
413,413,"areaprint Slovak Republic, s.r.o.",2023-09-13,-292.8,EUR,FD-1750-plagat,Platobný príkaz na úhradu / FIT 2.0 (EB),20232944.0,
414,414,Sprava cestovneho ruchu Senec s.r.o,2023-09-13,-480.0,EUR,FD-1751-prenajom,Platobný príkaz na úhradu / FIT 2.0 (EB),2023419.0,
415,415,PRINTHALL S.R.O.,2023-09-13,-534.0,EUR,FD-1752-letaky,Platobný príkaz na úhradu / FIT 2.0 (EB),202308460.0,
416,416,Marek Turansky,2023-09-13,-1300.0,EUR,FD-1753-technicke zabezpecenie sport.zariad.,Platobný príkaz na úhradu / FIT 2.0 (EB),10230004.0,
417,417,"WAYF, spol.s r.o.",2023-09-13,-420.0,EUR,FD-1754-hudobna produkcia,Platobný príkaz na úhradu / FIT 2.0 (EB),2308006.0,
418,418,PRORENTAL Stage s.r.o.,2023-09-13,-1450.0,EUR,"FD-1755-ozvucenie,osvetlenie",Platobný príkaz na úhradu / FIT 2.0 (EB),2023013.0,
419,419,BublinyVodne s.r.o.,2023-09-13,-550.0,EUR,FD-1756-skakaci hrad,Platobný príkaz na úhradu / FIT 2.0 (EB),292023.0,
420,420,Karnet Robert,2023-09-13,-900.0,EUR,FD-1757-prenajom atrakcie,Platobný príkaz na úhradu / FIT 2.0 (EB),230019.0,
421,421,"Domaca masovyroba,s.r.o.",2023-09-13,-591.96,EUR,FD-1758-obcerstvenie,Platobný príkaz na úhradu / FIT 2.0 (EB),230810.0,
422,422,MESTSK  KULT RNE STREDISKO MICHALOV,2023-09-13,-100.0,EUR,FD-1759-prenajom a ozvucenie,Platobný príkaz na úhradu / FIT 2.0 (EB),230464.0,
423,423,,2023-09-12,-0.25,EUR,Poplatok za platbu kartou,Poplatok za kartovú transakciu,,
424,424,,2023-09-12,-800.0,EUR,"B1617420244-44544 17** **** 8717;FACEBK *XS6TPSFG72 ,fb.me/ads ,IE ;11.09.2023 18:45:11 ;CashBack:0 EUR",Platba kartou,,
425,425,,2023-09-12,-0.25,EUR,Poplatok za platbu kartou,Poplatok za kartovú transakciu,,
426,426,,2023-09-12,-500.0,EUR,"B1617325408-44544 17** **** 8717;GOOGLE *ADS6073399833 ,cc@google.com ,IE ;11.09.2023 14:06:13 ;CashBack:0 EUR",Platba kartou,,
427,427,,2023-09-11,-0.25,EUR,Poplatok za platbu kartou,Poplatok za kartovú transakciu,,
428,428,,2023-09-11,-800.0,EUR,"B1616875005-44544 17** **** 8717;FACEBK *H8XAVSTG72 ,fb.me/ads ,IE ;10.09.2023 19:32:09 ;CashBack:0 EUR",Platba kartou,,
429,429,,2023-09-10,-0.25,EUR,Poplatok za platbu kartou,Poplatok za kartovú transakciu,,
430,430,,2023-09-10,-500.0,EUR,"B1616180612-44544 17** **** 8717;GOOGLE *ADS6073399833 ,cc@google.com ,IE ;09.09.2023 09:56:53 ;CashBack:0 EUR",Platba kartou,,
431,431,,2023-09-10,-0.25,EUR,Poplatok za platbu kartou,Poplatok za kartovú transakciu,,
432,432,,2023-09-10,-273.93,EUR,"B1616149681-44544 17** **** 8717;FACEBK *ZAS4PTPG72 ,fb.me/ads ,IE ;09.09.2023 15:57:25 ;CashBack:0 EUR",Platba kartou,,
433,433,,2023-09-09,-0.25,EUR,Poplatok za platbu kartou,Poplatok za kartovú transakciu,,
434,434,,2023-09-09,-800.0,EUR,"B1615364527-44544 17** **** 8717;FACEBK *Z64S4SXF72 ,fb.me/ads ,IE ;08.09.2023 20:55:21 ;CashBack:0 EUR",Platba kartou,,
435,435,,2023-09-09,-0.25,EUR,Poplatok za platbu kartou,Poplatok za kartovú transakciu,,
436,436,,2023-09-09,-800.0,EUR,"B1614373092-44544 17** **** 8717;FACEBK *ZK5YUQXG72 ,fb.me/ads ,IE ;07.09.2023 08:20:32 ;CashBack:0 EUR",Platba kartou,,
437,437,MESTSKA CAST VRAKUNA,2023-09-08,-120.0,EUR,FD-1707-dan za uzivanie verejneho priestranstva,Platobný príkaz na úhradu / FIT 2.0 (EB),6130115419.0,
438,438,"M KREO, s.r.o.",2023-09-08,-390.0,EUR,FD-1708-polep auta,Platobný príkaz na úhradu / FIT 2.0 (EB),20230246.0,
439,439,HOSPITALITY group s.r.o.,2023-09-08,-283.2,EUR,FD-1709-prenajom pivnych setov,Platobný príkaz na úhradu / FIT 2.0 (EB),230409114.0,
440,440,RAPOS s.r.o.,2023-09-08,-27.55,EUR,FD-1710-plagat,Platobný príkaz na úhradu / FIT 2.0 (EB),2023900.0,
441,441,Obec Hlinik nad Hronom,2023-09-08,-45.0,EUR,FD-1711-oznam v rozhlase,Platobný príkaz na úhradu / FIT 2.0 (EB),4052023.0,
442,442,SAD LUCENEC,2023-09-08,-338.28,EUR,FD-1712-preprava,Platobný príkaz na úhradu / FIT 2.0 (EB),230213021.0,
443,443,"TAMPEX PRESOV, SPOL.",2023-09-08,-372.0,EUR,FD-1713-podpiskarty,Platobný príkaz na úhradu / FIT 2.0 (EB),2301170.0,
444,444,Siettex s.r.o.,2023-09-08,-399.6,EUR,FD-1714-merkantil,Platobný príkaz na úhradu / FIT 2.0 (EB),20230344.0,
445,445,"Red Post,s.r.o.",2023-09-08,-6912.77,EUR,Zalohova fa c.55-distribucia letakov,Platobný príkaz na úhradu / FIT 2.0 (EB),2023030.0,
446,446,MESTSKA CAST VRAKUNA,2023-09-08,-250.0,EUR,FD-1706-dan za uzivanie verejneho priestranstva,Platobný príkaz na úhradu / FIT 2.0 (EB),6130015419.0,
447,447,Financna sprava Bratislava,2023-09-08,-4143.84,EUR,DPH-8/2023,Platobný príkaz na úhradu / FIT 2.0 (EB),,
448,448,,2023-09-08,-0.25,EUR,Poplatok za platbu kartou,Poplatok za kartovú transakciu,,
449,449,,2023-09-08,-800.0,EUR,"B1613471894-44544 17** **** 8717;FACEBK *6HK32SXF72 ,fb.me/ads ,IE ;06.09.2023 08:44:41 ;CashBack:0 EUR",Platba kartou,,
450,450,,2023-09-06,-0.25,EUR,Poplatok za platbu kartou,Poplatok za kartovú transakciu,,
451,451,,2023-09-06,-800.0,EUR,"B1612878358-44544 17** **** 8717;FACEBK *5UEMJTPG72 ,fb.me/ads ,IE ;05.09.2023 08:49:53 ;CashBack:0 EUR",Platba kartou,,
452,452,Harcar Stefan - STEEVEPRESS,2023-09-06,-36.0,EUR,FD-1691-zhotovenie letakov,Platobný príkaz na úhradu / FIT 2.0 (EB),20230814.0,
453,453,"Virtuality,s.r.o.",2023-09-05,-150.0,EUR,FD-1653-reklamna plocha,Platobný príkaz na úhradu / FIT 2.0 (EB),4223080001.0,
454,454,Mesto Roznava,2023-09-05,-189.2,EUR,FD-1654-verejne priestranstvo,Platobný príkaz na úhradu / FIT 2.0 (EB),1500028152.0,2303010982.0
455,455,"DOMINA MICHALANY, spol. s r.o.",2023-09-05,-758.0,EUR,FD-1655-obcerstvenie na mitingu,Platobný príkaz na úhradu / FIT 2.0 (EB),312023.0,
456,456,OZ H2 SECURITY,2023-09-05,-180.0,EUR,FD-1656-usporiadat.sluzba,Platobný príkaz na úhradu / FIT 2.0 (EB),160823006.0,
457,457,Glasfol MEDIA s.r.o.,2023-09-05,-84.0,EUR,FD-1657-plagaty,Platobný príkaz na úhradu / FIT 2.0 (EB),20230066.0,
458,458,,2023-09-04,-0.25,EUR,Poplatok za platbu kartou,Poplatok za kartovú transakciu,,
459,459,,2023-09-04,-800.0,EUR,"B1611512238-44544 17** **** 8717;FACEBK *NFMKFSFG72 ,fb.me/ads ,IE ;03.09.2023 10:57:36 ;CashBack:0 EUR",Platba kartou,,
460,460,,2023-09-02,-0.25,EUR,Poplatok za platbu kartou,Poplatok za kartovú transakciu,,
461,461,,2023-09-02,-800.0,EUR,"B1610520585-44544 17** **** 8717;FACEBK *EUYGVRXF72 ,fb.me/ads ,IE ;01.09.2023 17:42:20 ;CashBack:0 EUR",Platba kartou,,
462,462,,2023-09-02,-0.25,EUR,Poplatok za platbu kartou,Poplatok za kartovú transakciu,,
463,463,,2023-09-02,-750.0,EUR,"B1609550873-44544 17** **** 8717;FACEBK *HTTZJSTG72 ,fb.me/ads ,IE ;31.08.2023 11:25:12 ;CashBack:0 EUR",Platba kartou,,
464,464,,2023-09-01,-0.25,EUR,Poplatok za platbu kartou,Poplatok za kartovú transakciu,,
465,465,,2023-09-01,-768.57,EUR,"B1608730529-44544 17** **** 8717;FACEBK *PMZS6SBG72 ,fb.me/ads ,IE ;30.08.2023 13:57:53 ;CashBack:0 EUR",Platba kartou,,
466,466,,2023-09-01,-0.25,EUR,Poplatok za platbu kartou,Poplatok za kartovú transakciu,,
467,467,,2023-09-01,-61.43,EUR,"B1608738846-44544 17** **** 8717;FACEBK *MHLUBSFG72 ,fb.me/ads ,IE ;30.08.2023 17:45:07 ;CashBack:0 EUR",Platba kartou,,
468,468,,2023-08-31,-5.0,EUR,Zverejňovanie účtu,Poplatok,,
469,469,,2023-08-31,-5.0,EUR,Poplatok za vedenie účtu,Poplatok,,
470,470,Fiantok Milan BRUFIA,2023-08-31,-1200.0,EUR,FD-1602-umelecky vykon,Platobný príkaz na úhradu / FIT 2.0 (EB),9.0,
471,471,SEDEM - reklamna agentura,2023-08-31,-4186.8,EUR,"FD-1646-plagaty, reklamne predmety",Platobný príkaz na úhradu / FIT 2.0 (EB),112300345.0,
472,472,,2023-08-30,-0.25,EUR,Poplatok za platbu kartou,Poplatok za kartovú transakciu,,
473,473,,2023-08-30,-785.09,EUR,"B1608281243-44544 17** **** 8717;FACEBK *GY48SRXF72 ,fb.me/ads ,IE ;29.08.2023 14:15:06 ;CashBack:0 EUR",Platba kartou,,
474,474,,2023-08-29,-0.25,EUR,Poplatok za platbu kartou,Poplatok za kartovú transakciu,,
475,475,,2023-08-29,-750.0,EUR,"B1607428658-44544 17** **** 8717;FACEBK *2AA2NS3H72 ,fb.me/ads ,IE ;28.08.2023 09:07:23 ;CashBack:0 EUR",Platba kartou,,
476,476,FIPEK s.r.o.,2023-08-29,-181.44,EUR,FD-1628-volebny stanok na zempl.jarmoku,Platobný príkaz na úhradu / FIT 2.0 (EB),2023003998.0,
477,477,Nadacia Slovenskeho futbaloveho zva,2023-08-29,-1500.0,EUR,FD-1627-technicke zabezpecenie sport.podujatia,Platobný príkaz na úhradu / FIT 2.0 (EB),2023003.0,
478,478,M.D.N s.r.o.,2023-08-29,-493.2,EUR,FD-1626-tricka a poloksele s logom,Platobný príkaz na úhradu / FIT 2.0 (EB),23020045.0,
479,479,"TAMPEX PRE OV, SPOL.",2023-08-29,-126.0,EUR,FD-1608-podpiskarty,Platobný príkaz na úhradu / FIT 2.0 (EB),2301096.0,
480,480,Harcar Stefan - STEEVEPRESS,2023-08-29,-12.0,EUR,FD-1607-zhotovenie letakov,Platobný príkaz na úhradu / FIT 2.0 (EB),20230808.0,
481,481,Mesto Bardejov,2023-08-29,-18.9,EUR,FD-1606-dan za uzivanie verejneho priestranstva,Platobný príkaz na úhradu / FIT 2.0 (EB),2929300041.0,
482,482,Erika Michalcinova - REKLAMA,2023-08-29,-350.04,EUR,FD-1605-marketing.sluzby,Platobný príkaz na úhradu / FIT 2.0 (EB),20230803.0,
483,483,"TAMPEX PRE OV, SPOL.",2023-08-29,-496.37,EUR,FD-1604-polokosele s logom,Platobný príkaz na úhradu / FIT 2.0 (EB),2301119.0,
484,484,PRIMA-PRINT,2023-08-29,-165.6,EUR,FD-1603-pozvanky,Platobný príkaz na úhradu / FIT 2.0 (EB),202307028.0,
485,485,Fobos trading s.r.o.,2023-08-29,-10516.8,EUR,FD-1599-podpis karty a merkantil,Platobný príkaz na úhradu / FIT 2.0 (EB),3110310135.0,
486,486,Pohostinstvo Mihalikova Adriana,2023-08-29,-490.06,EUR,FD-1598-prenajom priestoru,Platobný príkaz na úhradu / FIT 2.0 (EB),202300121.0,
487,487,"EKO HOLDING Slovakia, s.r.o.",2023-08-29,-1118.0,EUR,"FD-1597-zabezpec.akcie-ozvucenie,letaky,stan,malov.na tvar",Platobný príkaz na úhradu / FIT 2.0 (EB),2023002.0,
488,488,Premier media s.r.o.,2023-08-29,-4000.0,EUR,FD-1596-vyroba reklam.novin,Platobný príkaz na úhradu / FIT 2.0 (EB),12023.0,
489,489,"Marketing & Printing solutions,s.r.",2023-08-29,-10200.0,EUR,Zal.fa c.53-merkantil,Platobný príkaz na úhradu / FIT 2.0 (EB),30230002.0,
490,490,Blahovec Stefan,2023-08-29,-0.01,EUR,Blahovec Stefan-vratenie daru zo dna 15.08.2023,Platobný príkaz na úhradu / FIT 2.0 (EB),15082023.0,
491,491,,2023-08-28,-0.25,EUR,Poplatok za platbu kartou,Poplatok za kartovú transakciu,,
492,492,,2023-08-28,-750.0,EUR,"B1606925051-44544 17** **** 8717;FACEBK *2TH2FSTG72 ,fb.me/ads ,IE ;27.08.2023 08:30:04 ;CashBack:0 EUR",Platba kartou,,
493,493,"PETIT PRESS, A.S.DIV",2023-08-28,-960.0,EUR,FD-1601 - Inzercia MY Nitrianske noviny,Platobný príkaz na úhradu / FIT 2.0 (EB),,
494,494,mayer media,2023-08-28,-7000.0,EUR,FD - 1600 - medialny priestor,Platobný príkaz na úhradu / FIT 2.0 (EB),,
495,495,,2023-08-27,-0.25,EUR,Poplatok za platbu kartou,Poplatok za kartovú transakciu,,
496,496,,2023-08-27,-750.0,EUR,"B1606259262-44544 17** **** 8717;FACEBK *LUD8LS3H72 ,fb.me/ads ,IE ;26.08.2023 10:04:52 ;CashBack:0 EUR",Platba kartou,,
497,497,,2023-08-27,-0.25,EUR,Poplatok za platbu kartou,Poplatok za kartovú transakciu,,
498,498,,2023-08-27,-750.0,EUR,"B1605292409-44544 17** **** 8717;FACEBK *NRMW6SFG72 ,fb.me/ads ,IE ;25.08.2023 13:26:35 ;CashBack:0 EUR",Platba kartou,,
499,499,,2023-08-26,-0.25,EUR,Poplatok za platbu kartou,Poplatok za kartovú transakciu,,
500,500,,2023-08-26,-750.0,EUR,"B1604534699-44544 17** **** 8717;FACEBK *CS4NLR3G72 ,fb.me/ads ,IE ;24.08.2023 11:05:17 ;CashBack:0 EUR",Platba kartou,,
501,501,,2023-08-25,-0.25,EUR,Poplatok za platbu kartou,Poplatok za kartovú transakciu,,
502,502,,2023-08-25,-750.0,EUR,"B1603743297-44544 17** **** 8717;FACEBK *28USRRKG72 ,fb.me/ads ,IE ;23.08.2023 12:05:03 ;CashBack:0 EUR",Platba kartou,,
503,503,,2023-08-24,-0.25,EUR,Poplatok za platbu kartou,Poplatok za kartovú transakciu,,
504,504,,2023-08-24,-750.0,EUR,"B1602858776-44544 17** **** 8717;FACEBK *HXNTJR3G72 ,fb.me/ads ,IE ;22.08.2023 14:20:02 ;CashBack:0 EUR",Platba kartou,,
505,505,,2023-08-22,-0.25,EUR,Poplatok za platbu kartou,Poplatok za kartovú transakciu,,
506,506,,2023-08-22,-750.0,EUR,"B1602059271-44544 17** **** 8717;FACEBK *P8X84TPG72 ,fb.me/ads ,IE ;21.08.2023 14:50:15 ;CashBack:0 EUR",Platba kartou,,
507,507,,2023-08-21,-0.25,EUR,Poplatok za platbu kartou,Poplatok za kartovú transakciu,,
508,508,,2023-08-21,-750.0,EUR,"B1601545985-44544 17** **** 8717;FACEBK *KG49PRKG72 ,fb.me/ads ,IE ;20.08.2023 17:13:09 ;CashBack:0 EUR",Platba kartou,,
509,509,,2023-08-20,-0.25,EUR,Poplatok za platbu kartou,Poplatok za kartovú transakciu,,
510,510,,2023-08-20,-750.0,EUR,"B1600812578-44544 17** **** 8717;FACEBK *SW75GR3G72 ,fb.me/ads ,IE ;19.08.2023 14:46:17 ;CashBack:0 EUR",Platba kartou,,
511,511,,2023-08-20,-0.25,EUR,Poplatok za platbu kartou,Poplatok za kartovú transakciu,,
512,512,,2023-08-20,-750.0,EUR,"B1599916360-44544 17** **** 8717;FACEBK *BW7UTRBG72 ,fb.me/ads ,IE ;18.08.2023 20:48:25 ;CashBack:0 EUR",Platba kartou,,
513,513,,2023-08-19,-0.25,EUR,Poplatok za platbu kartou,Poplatok za kartovú transakciu,,
514,514,,2023-08-19,-750.0,EUR,"B1598992415-44544 17** **** 8717;FACEBK *TE6LYSPG72 ,fb.me/ads ,IE ;17.08.2023 14:59:55 ;CashBack:0 EUR",Platba kartou,,
515,515,,2023-08-18,-0.25,EUR,Poplatok za platbu kartou,Poplatok za kartovú transakciu,,
516,516,,2023-08-18,-750.0,EUR,"B1598088121-44544 17** **** 8717;FACEBK *J7MF8QXG72 ,fb.me/ads ,IE ;16.08.2023 19:37:29 ;CashBack:0 EUR",Platba kartou,,
517,517,,2023-08-17,-0.25,EUR,Poplatok za platbu kartou,Poplatok za kartovú transakciu,,
518,518,,2023-08-17,-750.0,EUR,"B1597244940-44544 17** **** 8717;FACEBK *SSJMJRKG72 ,fb.me/ads ,IE ;15.08.2023 16:10:31 ;CashBack:0 EUR",Platba kartou,,
519,519,,2023-08-15,-0.25,EUR,Poplatok za platbu kartou,Poplatok za kartovú transakciu,,
520,520,,2023-08-15,-750.0,EUR,"B1596369050-44544 17** **** 8717;FACEBK *CBU26QXG72 ,fb.me/ads ,IE ;14.08.2023 07:34:03 ;CashBack:0 EUR",Platba kartou,,
521,521,Mgr.art.Juraj Mravik,2023-08-15,-800.0,EUR,FD-1590-priprava tv spotov,Platobný príkaz na úhradu / FIT 2.0 (EB),20230012.0,
522,522,JM Communication,2023-08-15,-12096.0,EUR,FD-1580-prieskum verejnej mienky,Platobný príkaz na úhradu / FIT 2.0 (EB),2023027.0,
523,523,SMER - sociálna demokracia,2023-08-15,150000.0,EUR,Prevod z bezneho uctu SMER-SSD,Bezhotovostný vklad,14082023.0,31801242.0
524,524,SMER - sociálna demokracia,2023-08-15,150000.0,EUR,Dotacia z bezneho uctu SMER-SSD,Bezhotovostný vklad,,
525,525,Blahovec Štefan,2023-08-15,0.01,EUR,F001150820239933680,Bezhotovostný vklad,,
526,526,,2023-08-14,-0.25,EUR,Poplatok za platbu kartou,Poplatok za kartovú transakciu,,
527,527,,2023-08-14,-750.0,EUR,"B1595798625-44544 17** **** 8717;FACEBK *V5FSNRBG72 ,fb.me/ads ,IE ;13.08.2023 13:52:31 ;CashBack:0 EUR",Platba kartou,,
528,528,AGENTURA SMER,2023-08-14,-150000.0,EUR,Zalohova fa c.51-organiz.-technicke zabezpecenie volieb do NRSR,Platobný príkaz na úhradu / FIT 2.0 (EB),230800004.0,
529,529,AGENTURA SMER,2023-08-14,-150000.0,EUR,Zalohova fa c.51-organiz.-technicke zabezpecenie volieb do NRSR,Platobný príkaz na úhradu / FIT 2.0 (EB),230800004.0,
530,530,,2023-08-13,-0.25,EUR,Poplatok za platbu kartou,Poplatok za kartovú transakciu,,
531,531,,2023-08-13,-750.0,EUR,"B1595076222-44544 17** **** 8717;FACEBK *UX5USRFG72 ,fb.me/ads ,IE ;12.08.2023 11:38:43 ;CashBack:0 EUR",Platba kartou,,
532,532,,2023-08-13,-0.25,EUR,Poplatok za platbu kartou,Poplatok za kartovú transakciu,,
533,533,,2023-08-13,-750.0,EUR,"B1594239653-44544 17** **** 8717;FACEBK *B8M66S3H72 ,fb.me/ads ,IE ;11.08.2023 09:19:50 ;CashBack:0 EUR",Platba kartou,,
534,534,,2023-08-12,-0.25,EUR,Poplatok za platbu kartou,Poplatok za kartovú transakciu,,
535,535,,2023-08-12,-750.0,EUR,"B1593287055-44544 17** **** 8717;FACEBK *3NXPKRBG72 ,fb.me/ads ,IE ;10.08.2023 05:42:27 ;CashBack:0 EUR",Platba kartou,,
536,536,,2023-08-11,-0.25,EUR,Poplatok za platbu kartou,Poplatok za kartovú transakciu,,
537,537,,2023-08-11,-354.08,EUR,"B1592517183-44544 17** **** 8717;FACEBK *J46RJRBG72 ,fb.me/ads ,IE ;09.08.2023 06:17:03 ;CashBack:0 EUR",Platba kartou,,
538,538,Harcar Stefan - STEEVEPRESS,2023-08-10,-198.0,EUR,FD-1566-letaky,Platobný príkaz na úhradu / FIT 2.0 (EB),20230806.0,
539,539,Actly s.r.o.,2023-08-10,-13380.0,EUR,FD-1562-prieskum verejnej mienky,Platobný príkaz na úhradu / FIT 2.0 (EB),2023031.0,
540,540,,2023-08-09,-0.25,EUR,Poplatok za platbu kartou,Poplatok za kartovú transakciu,,
541,541,,2023-08-09,-750.0,EUR,"B1591833306-44544 17** **** 8717;FACEBK *RVFH3S3H72 ,fb.me/ads ,IE ;08.08.2023 14:42:14 ;CashBack:0 EUR",Platba kartou,,
542,542,,2023-08-08,-0.25,EUR,Poplatok za platbu kartou,Poplatok za kartovú transakciu,,
543,543,,2023-08-08,-750.0,EUR,"B1591077364-44544 17** **** 8717;FACEBK *DPP85RXF72 ,fb.me/ads ,IE ;07.08.2023 12:49:26 ;CashBack:0 EUR",Platba kartou,,
544,544,Financna sprava Bratislava,2023-08-08,-1241.08,EUR,DPH-7/2023,Platobný príkaz na úhradu / FIT 2.0 (EB),1100072023.0,202307.0
545,545,,2023-08-06,-0.25,EUR,Poplatok za platbu kartou,Poplatok za kartovú transakciu,,
546,546,,2023-08-06,-750.0,EUR,"B1590043453-44544 17** **** 8717;FACEBK *LHCN9RKG72 ,fb.me/ads ,IE ;05.08.2023 20:40:06 ;CashBack:0 EUR",Platba kartou,,
547,547,,2023-08-05,-0.25,EUR,Poplatok za platbu kartou,Poplatok za kartovú transakciu,,
548,548,,2023-08-05,-750.0,EUR,"B1589114500-44544 17** **** 8717;FACEBK *MPCLXR3H72 ,fb.me/ads ,IE ;04.08.2023 07:26:56 ;CashBack:0 EUR",Platba kartou,,
549,549,Zdenko Malcho - LUKY MZ,2023-08-03,-269.0,EUR,FD-1458-helium,Platobný príkaz na úhradu / FIT 2.0 (EB),2320208553.0,
550,550,mayer media,2023-08-03,-7000.0,EUR,FD-1459-medialny priestor-extra plus plus,Platobný príkaz na úhradu / FIT 2.0 (EB),23012.0,
551,551,,2023-08-03,-750.0,EUR,"B1587162882-44544 17** **** 8717;FACEBK *SHM36RKG72 ,fb.me/ads ,IE ;01.08.2023 22:44:06 ;CashBack:0 EUR",Platba kartou,,
552,552,,2023-08-03,-0.25,EUR,Poplatok za platbu kartou,Poplatok za kartovú transakciu,,
553,553,,2023-08-03,-0.25,EUR,Poplatok za platbu kartou,Poplatok za kartovú transakciu,,
554,554,,2023-08-03,-310.79,EUR,"B1586822372-44544 17** **** 8717;GoogleAdwordsEU ADS607339 ,Dublin ,IE ;01.08.2023 17:28:32 ;CashBack:0 EUR",Platba kartou,,
555,555,Klub vojenskej historie Trnavska po,2023-08-01,-2500.0,EUR,FD-1451-kulturne vystupenie,Platobný príkaz na úhradu / FIT 2.0 (EB),2023004.0,
556,556,Abkals s.r.o.,2023-08-01,-858.0,EUR,FD-1447-oznacenie stanov logom,Platobný príkaz na úhradu / FIT 2.0 (EB),230329.0,
557,557,MESTSKE KULTURNE STR,2023-08-01,-200.0,EUR,FD-1456-kaucia na prenajom divadelnej saly,Platobný príkaz na úhradu / FIT 2.0 (EB),2023154.0,
558,558,Obec Sumiac,2023-08-01,-800.0,EUR,FD-1455-kulturne podujatie-Vatra zvrchovanosti,Platobný príkaz na úhradu / FIT 2.0 (EB),332023.0,
559,559,,2023-07-31,-5.0,EUR,Zverejňovanie účtu,Poplatok,,
560,560,,2023-07-31,-5.0,EUR,Poplatok za vedenie účtu,Poplatok,,
561,561,,2023-07-30,-0.25,EUR,Poplatok za platbu kartou,Poplatok za kartovú transakciu,,
562,562,,2023-07-30,-750.0,EUR,"B1585067302-44544 17** **** 8717;FACEBK *QP5KUQ3G72 ,fb.me/ads ,IE ;29.07.2023 19:03:27 ;CashBack:0 EUR",Platba kartou,,
563,563,,2023-07-25,-0.25,EUR,Poplatok za platbu kartou,Poplatok za kartovú transakciu,,
564,564,,2023-07-25,-750.0,EUR,"B1581083196-44544 17** **** 8717;FACEBK *U6DM9RFG72 ,fb.me/ads ,IE ;24.07.2023 18:04:11 ;CashBack:0 EUR",Platba kartou,,
565,565,AGENTURA SMER,2023-07-24,-160000.0,EUR,Zaloh.fa c.50-organiz.-technicke zabezpecenie volieb do NR SR 2023,Platobný príkaz na úhradu / FIT 2.0 (EB),230800003.0,
566,566,AGENTURA SMER,2023-07-24,-80000.0,EUR,Zaloh.fa c.50-organiz.-technicke zabezpecenie volieb do NR SR 2023,Platobný príkaz na úhradu / FIT 2.0 (EB),230800003.0,
567,567,AGENTURA SMER,2023-07-24,-160000.0,EUR,Zaloh.fa c.50-organiz.-technicke zabezpecenie volieb do NR SR 2023,Platobný príkaz na úhradu / FIT 2.0 (EB),230800003.0,
568,568,,2023-07-22,-0.25,EUR,Poplatok za platbu kartou,Poplatok za kartovú transakciu,,
569,569,,2023-07-22,-750.0,EUR,"B1577982472-44544 17** **** 8717;FACEBK *5EYJYQBG72 ,fb.me/ads ,IE ;20.07.2023 14:48:10 ;CashBack:0 EUR",Platba kartou,,
570,570,MESTO SPISSKA NOVA V,2023-07-19,-110.0,EUR,FD-1411-inzercia,Platobný príkaz na úhradu / FIT 2.0 (EB),9112300194.0,
571,571,Lesy mesta Spisska Nova Ves s.r.o.,2023-07-19,-61.08,EUR,FD-1412-Vatra zvrchov.-drevo,Platobný príkaz na úhradu / FIT 2.0 (EB),,
572,572,MESTSKE KULTURNE CENTRUM SNV,2023-07-19,-75.0,EUR,FD-1413-prenajom,Platobný príkaz na úhradu / FIT 2.0 (EB),,
573,573,Diamond Vision s.r.o.,2023-07-19,-555.5,EUR,"FD-1414-Vatra zvrch.-plagaty,baner, vystupenie folkl.suboru",Platobný príkaz na úhradu / FIT 2.0 (EB),2023015.0,
574,574,"BELS gastro,s.r.o.",2023-07-19,-357.0,EUR,FD-1415-Vatra zvrchov.-obcerstvenie,Platobný príkaz na úhradu / FIT 2.0 (EB),20230701.0,
575,575,Obec Harichovce,2023-07-19,-250.0,EUR,FD-1416-vystupenie folklor.skupiny,Platobný príkaz na úhradu / FIT 2.0 (EB),1315300009.0,
576,576,Jan Mrosko - JM studio,2023-07-19,-200.0,EUR,FD-1417-Vatra zvrchov.-ozvucenie,Platobný príkaz na úhradu / FIT 2.0 (EB),2023005.0,
577,577,"S-ART,o.z.",2023-07-19,-800.0,EUR,FD-1418-Vatra zvrchov.-hudob.vystupenie,Platobný príkaz na úhradu / FIT 2.0 (EB),2023008.0,
578,578,,2023-07-18,-0.25,EUR,Poplatok za platbu kartou,Poplatok za kartovú transakciu,,
579,579,,2023-07-18,-750.0,EUR,"B1575505214-44544 17** **** 8717;FACEBK *ZAVGVQBG72 ,fb.me/ads ,IE ;17.07.2023 07:08:08 ;CashBack:0 EUR",Platba kartou,,
580,580,Actly s.r.o.,2023-07-17,-11880.0,EUR,FD-1367-prieskum,Platobný príkaz na úhradu / FIT 2.0 (EB),2023026.0,
581,581,Actly s.r.o.,2023-07-17,-2376.0,EUR,FD-1368-prieskum,Platobný príkaz na úhradu / FIT 2.0 (EB),2023027.0,
582,582,Belica s.r.o.,2023-07-17,-2040.0,EUR,"FD-1369-stan,vlajky lehatko,stolik,..",Platobný príkaz na úhradu / FIT 2.0 (EB),23030066.0,
583,583,LAVACOM s.r.o.,2023-07-17,-102.0,EUR,FD-1370-letaky,Platobný príkaz na úhradu / FIT 2.0 (EB),2301260212.0,
584,584,MIESTNY  RAD MES. .K,2023-07-17,-990.0,EUR,FD-1371-prenajom sport.arealu,Platobný príkaz na úhradu / FIT 2.0 (EB),1312300060.0,
585,585,"ZaMED, s.r.o.",2023-07-17,-102.0,EUR,FD-1393-zdravotny dozor,Platobný príkaz na úhradu / FIT 2.0 (EB),52023086.0,
586,586,RAPOS s.r.o.,2023-07-17,-154.08,EUR,FD-1395-plagaty,Platobný príkaz na úhradu / FIT 2.0 (EB),2023698.0,
587,587,,2023-07-14,-0.25,EUR,Poplatok za platbu kartou,Poplatok za kartovú transakciu,,
588,588,,2023-07-14,-750.0,EUR,"B1571596883-44544 17** **** 8717;FACEBK *QKQLXP7G72 ,fb.me/ads ,IE ;12.07.2023 19:54:11 ;CashBack:0 EUR",Platba kartou,,
589,589,Z & K Tech s.r.o.,2023-07-12,-787.2,EUR,FD-1351-MDD-obcerstvenie,Platobný príkaz na úhradu / FIT 2.0 (EB),230011.0,
590,590,HaMi s.r.o.,2023-07-12,-390.0,EUR,FD-1350-MDD-obcerstvenie,Platobný príkaz na úhradu / FIT 2.0 (EB),20011259.0,
591,591,Financna sprava Bratislava,2023-07-11,-1358.8,EUR,DPH-6/2023,Platobný príkaz na úhradu / FIT 2.0 (EB),1100062023.0,202306.0
592,592,,2023-07-10,-0.25,EUR,Poplatok za platbu kartou,Poplatok za kartovú transakciu,,
593,593,,2023-07-10,-144.62,EUR,"B1569394910-44544 17** **** 8717;FACEBK *RY45NQBG72 ,fb.me/ads ,IE ;09.07.2023 06:21:14 ;CashBack:0 EUR",Platba kartou,,
594,594,,2023-07-09,-0.25,EUR,Poplatok za platbu kartou,Poplatok za kartovú transakciu,,
595,595,,2023-07-09,-750.0,EUR,"B1567888290-44544 17** **** 8717;FACEBK *N2A6FQKG72 ,fb.me/ads ,IE ;07.07.2023 17:59:07 ;CashBack:0 EUR",Platba kartou,,
596,596,UDERMAN s.r.o.,2023-07-07,-428.0,EUR,Zal.fa c.48-noznicove stany,Platobný príkaz na úhradu / FIT 2.0 (EB),172305677.0,
597,597,"L.FABRICA, s.r.o.",2023-07-04,-2278.8,EUR,"Zaloh.fa c.47-stany,vaky,sedatkavlajky",Platobný príkaz na úhradu / FIT 2.0 (EB),23080139.0,
598,598,,2023-07-03,-0.25,EUR,Poplatok za platbu kartou,Poplatok za kartovú transakciu,,
599,599,,2023-07-03,-750.0,EUR,"B1564501624-44544 17** **** 8717;FACEBK *ZJRPFQBG72 ,fb.me/ads ,IE ;02.07.2023 16:46:38 ;CashBack:0 EUR",Platba kartou,,
600,600,,2023-07-03,-500.0,EUR,"B1564463374-44544 17** **** 8717;GoogleAdwordsEU ADS607339 ,Dublin ,IE ;02.07.2023 08:40:39 ;CashBack:0 EUR",Platba kartou,,
601,601,,2023-07-03,-0.25,EUR,Poplatok za platbu kartou,Poplatok za kartovú transakciu,,
602,602,Stefan Ozorak ETIEN reklamka,2023-07-03,-78.0,EUR,FD-1269-plagaty,Platobný príkaz na úhradu / FIT 2.0 (EB),230102.0,
603,603,"music DRIVE production,s.r.o.",2023-07-03,-500.0,EUR,"FD-1268-skakaci hrad, tetovanie pri detskej akcii",Platobný príkaz na úhradu / FIT 2.0 (EB),50230005.0,
604,604,AGAL,2023-07-03,-184.47,EUR,FD-1274-kofola pri volebnej akcii,Platobný príkaz na úhradu / FIT 2.0 (EB),1.0,
605,605,,2023-07-02,-0.25,EUR,Poplatok za platbu kartou,Poplatok za kartovú transakciu,,
606,606,,2023-07-02,-183.48,EUR,"B1563913438-44544 17** **** 8717;GoogleAdwordsEU ADS607339 ,Dublin ,IE ;01.07.2023 18:02:19 ;CashBack:0 EUR",Platba kartou,,
607,607,,2023-07-02,-0.25,EUR,Poplatok za platbu kartou,Poplatok za kartovú transakciu,,
608,608,,2023-07-02,-500.0,EUR,"B1563072985-44544 17** **** 8717;GoogleAdwordsEU ADS607339 ,Dublin ,IE ;30.06.2023 19:41:40 ;CashBack:0 EUR",Platba kartou,,
609,609,,2023-07-02,-0.25,EUR,Poplatok za platbu kartou,Poplatok za kartovú transakciu,,
610,610,,2023-07-02,-106.12,EUR,"B1562959667-44544 17** **** 8717;FACEBK T6J84RK8S2 ,fb.me/ads ,IE ;30.06.2023 12:27:56 ;CashBack:0 EUR",Platba kartou,,
611,611,,2023-06-30,-5.0,EUR,Zverejňovanie účtu,Poplatok,,
612,612,,2023-06-30,-5.0,EUR,Poplatok za vedenie účtu,Poplatok,,
613,613,"L.FABRICA, s.r.o.",2023-06-30,-903.6,EUR,Zaloh.fa c.46-stan na volebne akcie,Platobný príkaz na úhradu / FIT 2.0 (EB),23080146.0,
614,614,,2023-06-29,-750.0,EUR,"B1561451444-44544 17** **** 8717;FACEBK *MNLWXPXF72 ,fb.me/ads ,IE ;28.06.2023 10:22:05 ;CashBack:0 EUR",Platba kartou,,
615,615,,2023-06-29,-0.2,EUR,Poplatok za platbu kartou,Poplatok za kartovú transakciu,,
616,616,"L.FABRICA, s.r.o.",2023-06-28,-2278.8,EUR,"Zalohova fa c.44-stan, vaky lehatka,vlajky,stolik",Platobný príkaz na úhradu / FIT 2.0 (EB),23080139.0,
617,617,"L.FABRICA, s.r.o.",2023-06-28,-2064.0,EUR,"Zalohova fa c.43-stan,vlajka,stolik",Platobný príkaz na úhradu / FIT 2.0 (EB),23080147.0,
618,618,,2023-06-27,-0.2,EUR,Poplatok za platbu kartou,Poplatok za kartovú transakciu,,
619,619,,2023-06-27,-500.0,EUR,"B1559926465-44544 17** **** 8717;GoogleAdwordsEU ADS607339 ,Dublin ,IE ;26.06.2023 22:52:15 ;CashBack:0 EUR",Platba kartou,,
620,620,AGENT RA SMER,2023-06-27,-160000.0,EUR,Zalohova fa c.42-zaloha na organiz.-tech.zabezpecenie volebnej kampane,Platobný príkaz na úhradu / FIT 2.0 (EB),230800002.0,
621,621,AGENT RA SMER,2023-06-27,-160000.0,EUR,Zalohova fa c.42-zaloha na organiz.-tech.zabezpecenie volebnej kampane,Platobný príkaz na úhradu / FIT 2.0 (EB),230800002.0,
622,622,AGENT RA SMER,2023-06-27,-160000.0,EUR,Zalohova fa c.42-zaloha na organiz.tech. zebezpecenie volebnej kampane,Platobný príkaz na úhradu / FIT 2.0 (EB),230800002.0,
623,623,AGENT RA SMER,2023-06-27,-40000.0,EUR,Zalohova fa c.42-zaloha na organiz.-tech. zabezpecenie volebnej kampane,Platobný príkaz na úhradu / FIT 2.0 (EB),230800002.0,
624,624,AGENT RA SMER,2023-06-27,-160000.0,EUR,Zalohova fa c.42-zaloha na otganiz.-tech.zabezpecenie volebnej kampane,Platobný príkaz na úhradu / FIT 2.0 (EB),230800002.0,
625,625,AGENT RA SMER,2023-06-27,-160000.0,EUR,Zalohova fa c.42-zaloha na organiz.-tech.zabezpecenie volebnej kampane,Platobný príkaz na úhradu / FIT 2.0 (EB),230800002.0,
626,626,AGENT RA SMER,2023-06-27,-160000.0,EUR,Zalohova fa c.42-zaloha na organiz.-tech.zebezpecenie volebnej kampane,Platobný príkaz na úhradu / FIT 2.0 (EB),230800002.0,
627,627,,2023-06-23,-0.2,EUR,Poplatok za platbu kartou,Poplatok za kartovú transakciu,,
628,628,,2023-06-23,-750.0,EUR,"B1556872864-44544 17** **** 8717;FACEBK *GJP2MNXG72 ,fb.me/ads ,IE ;22.06.2023 12:16:13 ;CashBack:0 EUR",Platba kartou,,
629,629,,2023-06-22,-0.2,EUR,Poplatok za platbu kartou,Poplatok za kartovú transakciu,,
630,630,,2023-06-22,-750.0,EUR,"B1556057143-44544 17** **** 8717;FACEBK *L4NWFQTG72 ,fb.me/ads ,IE ;21.06.2023 10:00:27 ;CashBack:0 EUR",Platba kartou,,
631,631,,2023-06-22,-0.2,EUR,Poplatok za platbu kartou,Poplatok za kartovú transakciu,,
632,632,,2023-06-22,-500.0,EUR,"B1555998044-44544 17** **** 8717;GoogleAdwordsEU ADS607339 ,Dublin ,IE ;21.06.2023 00:44:01 ;CashBack:0 EUR",Platba kartou,,
633,633,"ZaMED, s.r.o.",2023-06-21,-510.0,EUR,zalohova fa c.38-zdravotny dozor na akcii Cyril a Metod,Platobný príkaz na úhradu / FIT 2.0 (EB),62023068.0,
634,634,,2023-06-20,-0.2,EUR,Poplatok za platbu kartou,Poplatok za kartovú transakciu,,
635,635,,2023-06-20,-750.0,EUR,"B1554518785-44544 17** **** 8717;FACEBK *UT658QFG72 ,fb.me/ads ,IE ;19.06.2023 16:12:41 ;CashBack:0 EUR",Platba kartou,,
636,636,,2023-06-20,-8.0,EUR,Poplatok za výber hotovosti,Poplatok,,
637,637,,2023-06-20,-5000.0,EUR,dotácia do pokladne voľby NR SR 2023,Výber hotovosti,,
638,638,,2023-06-18,-750.0,EUR,"B1553285959-44544 17** **** 8717;FACEBK *UYEB6QFG72 ,fb.me/ads ,IE ;17.06.2023 17:49:55 ;CashBack:0 EUR",Platba kartou,,
639,639,,2023-06-18,-0.2,EUR,Poplatok za platbu kartou,Poplatok za kartovú transakciu,,
640,640,,2023-06-18,-0.2,EUR,Poplatok za platbu kartou,Poplatok za kartovú transakciu,,
641,641,,2023-06-18,-750.0,EUR,"B1553173131-44544 17** **** 8717;FACEBK *XB9W5QFG72 ,fb.me/ads ,IE ;17.06.2023 08:23:52 ;CashBack:0 EUR",Platba kartou,,
642,642,,2023-06-15,-0.2,EUR,Poplatok za platbu kartou,Poplatok za kartovú transakciu,,
643,643,,2023-06-15,-150.0,EUR,"B1550480223-44544 17** **** 8717;FACEBK *EEZREQ3H72 ,fb.me/ads ,IE ;14.06.2023 08:25:49 ;CashBack:0 EUR",Platba kartou,,
644,644,MESTO NOVE ZAMKY,2023-06-15,-400.0,EUR,FD-1197-inzercia,Platobný príkaz na úhradu / FIT 2.0 (EB),2116300443.0,
645,645,,2023-06-13,-0.2,EUR,Poplatok za platbu kartou,Poplatok za kartovú transakciu,,
646,646,,2023-06-13,-100.0,EUR,"B1548960362-44544 17** **** 8717;FACEBK *MFG3ZPFG72 ,fb.me/ads ,IE ;12.06.2023 18:51:58 ;CashBack:0 EUR",Platba kartou,,
647,647,,2023-06-12,-0.2,EUR,Poplatok za platbu kartou,Poplatok za kartovú transakciu,,
648,648,,2023-06-12,-70.0,EUR,"B1548457804-44544 17** **** 8717;FACEBK *Q4E6DP3G72 ,fb.me/ads ,IE ;11.06.2023 16:25:32 ;CashBack:0 EUR",Platba kartou,,
649,649,,2023-06-12,-0.2,EUR,Poplatok za platbu kartou,Poplatok za kartovú transakciu,,
650,650,,2023-06-12,-40.0,EUR,"B1548455135-44544 17** **** 8717;FACEBK *XPN5SPBG72 ,fb.me/ads ,IE ;11.06.2023 08:19:43 ;CashBack:0 EUR",Platba kartou,,
651,651,,2023-06-11,-0.2,EUR,Poplatok za platbu kartou,Poplatok za kartovú transakciu,,
652,652,,2023-06-11,-11.17,EUR,"B1547889161-44544 17** **** 8717;FACEBK *BWY25QTG72 ,fb.me/ads ,IE ;10.06.2023 23:04:36 ;CashBack:0 EUR",Platba kartou,,
653,653,,2023-06-11,-0.2,EUR,Poplatok za platbu kartou,Poplatok za kartovú transakciu,,
654,654,,2023-06-11,-2.37,EUR,"B1547769355-44544 17** **** 8717;FACEBK *JW7UWQPG72 ,fb.me/ads ,IE ;10.06.2023 10:25:16 ;CashBack:0 EUR",Platba kartou,,
655,655,,2023-06-11,-0.2,EUR,Poplatok za platbu kartou,Poplatok za kartovú transakciu,,
656,656,,2023-06-11,-4.0,EUR,"B1547769350-44544 17** **** 8717;FACEBK *WP6TBP3G72 ,fb.me/ads ,IE ;10.06.2023 09:07:16 ;CashBack:0 EUR",Platba kartou,,
657,657,,2023-06-11,-0.2,EUR,Poplatok za platbu kartou,Poplatok za kartovú transakciu,,
658,658,,2023-06-11,-2.17,EUR,"B1547769347-44544 17** **** 8717;FACEBK *29VMXN7G72 ,fb.me/ads ,IE ;10.06.2023 09:35:56 ;CashBack:0 EUR",Platba kartou,,
659,659,,2023-06-11,-0.2,EUR,Poplatok za platbu kartou,Poplatok za kartovú transakciu,,
660,660,,2023-06-11,-2.0,EUR,"B1547769345-44544 17** **** 8717;FACEBK *9NCFDPXF72 ,fb.me/ads ,IE ;10.06.2023 09:07:00 ;CashBack:0 EUR",Platba kartou,,
661,661,,2023-06-11,-0.2,EUR,Poplatok za platbu kartou,Poplatok za kartovú transakciu,,
662,662,,2023-06-11,-2.0,EUR,"B1547769342-44544 17** **** 8717;FACEBK *62AK8NXG72 ,fb.me/ads ,IE ;10.06.2023 08:38:47 ;CashBack:0 EUR",Platba kartou,,
663,663,,2023-06-11,-0.2,EUR,Poplatok za platbu kartou,Poplatok za kartovú transakciu,,
664,664,,2023-06-11,-2.0,EUR,"B1547769339-44544 17** **** 8717;FACEBK *9P24RPBG72 ,fb.me/ads ,IE ;10.06.2023 08:10:04 ;CashBack:0 EUR",Platba kartou,,
665,665,,2023-06-11,-0.2,EUR,Poplatok za platbu kartou,Poplatok za kartovú transakciu,,
666,666,,2023-06-11,-2.0,EUR,"B1547769331-44544 17** **** 8717;FACEBK *NMJQWQPG72 ,fb.me/ads ,IE ;10.06.2023 07:39:40 ;CashBack:0 EUR",Platba kartou,,
667,667,,2023-06-11,-0.2,EUR,Poplatok za platbu kartou,Poplatok za kartovú transakciu,,
668,668,,2023-06-11,-2.0,EUR,"B1547769108-44544 17** **** 8717;FACEBK *7VQKAQ3H72 ,fb.me/ads ,IE ;10.06.2023 07:17:34 ;CashBack:0 EUR",Platba kartou,,
669,669,,2023-06-11,-0.2,EUR,Poplatok za platbu kartou,Poplatok za kartovú transakciu,,
670,670,,2023-06-11,-2.0,EUR,"B1547766941-44544 17** **** 8717;FACEBK *X3BNBP3G72 ,fb.me/ads ,IE ;10.06.2023 06:35:51 ;CashBack:0 EUR",Platba kartou,,
671,671,,2023-06-11,-0.2,EUR,Poplatok za platbu kartou,Poplatok za kartovú transakciu,,
672,672,,2023-06-11,-30.0,EUR,"B1547782440-44544 17** **** 8717;FACEBK *8QH8BQ3H72 ,fb.me/ads ,IE ;10.06.2023 17:14:50 ;CashBack:0 EUR",Platba kartou,,
673,673,,2023-06-11,-0.2,EUR,Poplatok za platbu kartou,Poplatok za kartovú transakciu,,
674,674,,2023-06-11,-0.2,EUR,Poplatok za platbu kartou,Poplatok za kartovú transakciu,,
675,675,,2023-06-11,-8.26,EUR,"B1547770280-44544 17** **** 8717;FACEBK *3S6XAQ3H72 ,fb.me/ads ,IE ;10.06.2023 15:22:06 ;CashBack:0 EUR",Platba kartou,,
676,676,,2023-06-11,-0.2,EUR,Poplatok za platbu kartou,Poplatok za kartovú transakciu,,
677,677,,2023-06-11,-0.03,EUR,"B1547766928-44544 17** **** 8717;FACEBK *QNYWQPBG72 ,fb.me/ads ,IE ;10.06.2023 04:35:50 ;CashBack:0 EUR",Platba kartou,,
678,678,,2023-06-11,-10.08,EUR,"B1547782430-44544 17** **** 8717;FACEBK *NWE2YN7G72 ,fb.me/ads ,IE ;10.06.2023 18:03:29 ;CashBack:0 EUR",Platba kartou,,
679,679,,2023-06-11,-0.2,EUR,Poplatok za platbu kartou,Poplatok za kartovú transakciu,,
680,680,,2023-06-11,-0.2,EUR,Poplatok za platbu kartou,Poplatok za kartovú transakciu,,
681,681,,2023-06-11,-12.0,EUR,"B1547770265-44544 17** **** 8717;FACEBK *S5ZVAQ3H72 ,fb.me/ads ,IE ;10.06.2023 12:57:01 ;CashBack:0 EUR",Platba kartou,,
682,682,,2023-06-11,-0.2,EUR,Poplatok za platbu kartou,Poplatok za kartovú transakciu,,
683,683,,2023-06-11,-0.2,EUR,Poplatok za platbu kartou,Poplatok za kartovú transakciu,,
684,684,,2023-06-11,-20.0,EUR,"B1547782423-44544 17** **** 8717;FACEBK *4YLHRPBG72 ,fb.me/ads ,IE ;10.06.2023 14:39:26 ;CashBack:0 EUR",Platba kartou,,
685,685,,2023-06-11,-3.2,EUR,"B1547770254-44544 17** **** 8717;FACEBK *BKGBRPBG72 ,fb.me/ads ,IE ;10.06.2023 13:16:57 ;CashBack:0 EUR",Platba kartou,,
686,686,,2023-06-11,-0.2,EUR,Poplatok za platbu kartou,Poplatok za kartovú transakciu,,
687,687,,2023-06-11,-9.0,EUR,"B1547770250-44544 17** **** 8717;FACEBK *3LZARPBG72 ,fb.me/ads ,IE ;10.06.2023 11:29:32 ;CashBack:0 EUR",Platba kartou,,
688,688,,2023-06-11,-0.2,EUR,Poplatok za platbu kartou,Poplatok za kartovú transakciu,,
689,689,,2023-06-11,-3.8,EUR,"B1547770247-44544 17** **** 8717;FACEBK *L5GJ4QTG72 ,fb.me/ads ,IE ;10.06.2023 11:50:46 ;CashBack:0 EUR",Platba kartou,,
690,690,,2023-06-11,-0.2,EUR,Poplatok za platbu kartou,Poplatok za kartovú transakciu,,
691,691,,2023-06-11,-6.0,EUR,"B1547770243-44544 17** **** 8717;FACEBK *X4MJDPXF72 ,fb.me/ads ,IE ;10.06.2023 10:08:26 ;CashBack:0 EUR",Platba kartou,,
692,692,,2023-06-11,-0.2,EUR,Poplatok za platbu kartou,Poplatok za kartovú transakciu,,
693,693,,2023-06-11,-2.0,EUR,"B1547766935-44544 17** **** 8717;FACEBK *NX6NWQPG72 ,fb.me/ads ,IE ;10.06.2023 05:52:28 ;CashBack:0 EUR",Platba kartou,,
694,694,,2023-06-11,-2.0,EUR,"B1547766923-44544 17** **** 8717;FACEBK *HS59DPXF72 ,fb.me/ads ,IE ;10.06.2023 02:04:07 ;CashBack:0 EUR",Platba kartou,,
695,695,,2023-06-10,-0.2,EUR,Poplatok za platbu kartou,Poplatok za kartovú transakciu,,
696,696,,2023-06-10,-2.0,EUR,"B1547102935-44544 17** **** 8717;FACEBK *ZGLA8NXG72 ,fb.me/ads ,IE ;10.06.2023 00:56:14 ;CashBack:0 EUR",Platba kartou,,
697,697,,2023-06-10,-0.2,EUR,Poplatok za platbu kartou,Poplatok za kartovú transakciu,,
698,698,,2023-06-10,-0.02,EUR,"B1547102931-44544 17** **** 8717;FACEBK *58L5DPXF72 ,fb.me/ads ,IE ;10.06.2023 01:53:22 ;CashBack:0 EUR",Platba kartou,,
699,699,,2023-06-10,-0.2,EUR,Poplatok za platbu kartou,Poplatok za kartovú transakciu,,
700,700,,2023-06-10,-2.0,EUR,"B1547102074-44544 17** **** 8717;FACEBK *UP478NXG72 ,fb.me/ads ,IE ;09.06.2023 18:51:53 ;CashBack:0 EUR",Platba kartou,,
701,701,,2023-06-10,-0.2,EUR,Poplatok za platbu kartou,Poplatok za kartovú transakciu,,
702,702,,2023-06-10,-2.0,EUR,"B1547102648-44544 17** **** 8717;FACEBK *9D4AAQ3H72 ,fb.me/ads ,IE ;09.06.2023 23:11:08 ;CashBack:0 EUR",Platba kartou,,
703,703,,2023-06-10,-0.2,EUR,Poplatok za platbu kartou,Poplatok za kartovú transakciu,,
704,704,,2023-06-10,-0.3,EUR,"B1547102075-44544 17** **** 8717;FACEBK *XQ478NXG72 ,fb.me/ads ,IE ;09.06.2023 23:10:52 ;CashBack:0 EUR",Platba kartou,,
705,705,,2023-05-31,-5.0,EUR,Zverejňovanie účtu,Poplatok,,
706,706,,2023-05-31,-5.0,EUR,Poplatok za vedenie účtu,Poplatok,,
707,707,,2023-04-30,-5.0,EUR,Zverejňovanie účtu,Poplatok,,
708,708,,2023-04-30,-5.0,EUR,Poplatok za vedenie účtu,Poplatok,,
709,709,AGENT RA SMER,2023-04-24,-94416.85,EUR,FD-768-reklamne predmety,Platobný príkaz na úhradu / FIT 2.0 (EB),42023134.0,
710,710,NIVEL PLUS s.r.o.,2023-04-03,-1320.0,EUR,Zaloh.fa c.25-inzercia,Platobný príkaz na úhradu / FIT 2.0 (EB),1623910004.0,
711,711,"ISPA, SPOL. S R.O.",2023-04-03,-110.4,EUR,FD-530-billboardy,Platobný príkaz na úhradu / FIT 2.0 (EB),20231275.0,
712,712,,2023-03-31,-5.0,EUR,Zverejňovanie účtu,Poplatok,,
713,713,,2023-03-31,-3.06,EUR,Poplatok za vedenie účtu,Poplatok,,
714,714,AGENTURA SMER,2023-03-20,-100000.0,EUR,Zal.fa 19-reklamne predmety,Platobný príkaz na úhradu / FIT 2.0 (EB),230800001.0,
715,715,SMER - sociálna demokracia,2023-03-13,170000.0,EUR,Dotacia na volby NR SR 2023 z bu SMER SD,Bezhotovostný vklad,13032023.0,
716,716,SMER - sociálna demokracia,2023-03-13,170000.0,EUR,Dotacia na volby NR SR 2023 z bu SMER SD,Bezhotovostný vklad,13032023.0,
717,717,SMER - sociálna demokracia,2023-03-13,129990.0,EUR,Dotacia na volby NR SR 2023 z bu SMER SD,Bezhotovostný vklad,13032023.0,
718,718,SMER - sociálna demokracia,2023-03-13,170000.0,EUR,Dotacia na volby NR SR 2023 z bu SMER SD,Bezhotovostný vklad,13032023.0,
719,719,SMER - sociálna demokracia,2023-03-13,170000.0,EUR,Dotacia na volby NR SR 2023 z bu SMER SD,Bezhotovostný vklad,13032023.0,
720,720,SMER - sociálna demokracia,2023-03-13,170000.0,EUR,Dotacia na volby NR SR 2023 z bu SMER SD,Bezhotovostný vklad,,
721,721,SMER - sociálna demokracia,2023-03-13,170000.0,EUR,Dotacia na volby NR SR 2023 z bu SMER SD,Bezhotovostný vklad,13032023.0,
722,722,SMER - sociálna demokracia,2023-03-13,170000.0,EUR,Dotacia na volby NR SR 2023 z bu SMER SD,Bezhotovostný vklad,13032023.0,
723,723,SMER - sociálna demokracia,2023-03-13,170000.0,EUR,Dotacia na volby NR SR 2023 z bu SMER SD,Bezhotovostný vklad,13032023.0,
724,724,SMER - sociálna demokracia,2023-03-13,170000.0,EUR,Dotacia na volby NR SR 2023 z bu SMER SD,Bezhotovostný vklad,13032023.0,
725,725,SMER - sociálna demokracia,2023-03-13,170000.0,EUR,Dotacia na volby NR SR 2023 z bu SMER SD,Bezhotovostný vklad,13032023.0,
726,726,SMER - sociálna demokracia,2023-03-13,170000.0,EUR,Dotacia na volby NR SR 2023 z bu SMER SD,Bezhotovostný vklad,13032023.0,
727,727,SMER - sociálna demokracia,2023-03-13,10.0,EUR,Dotacia na volby NR SR 2023 z bu SMER SD,Bezhotovostný vklad,,